track_id,track_name,track_artist,lyrics,track_album_id,track_album_name,track_album_release_date,playlist_id,playlist_genre,playlist_subgenre,language,concatenated
04JmxH2IpgpIeZdbYswRq1,Azzlack Harami,Milonair,"Azzlack-Harami Hamad 45, Milonair, wir machen mit Abiad Massari Doppel H, Ruhrpott regieren Für jeden der Krieg will, glaub mir wir schießen Azzlack-Harami Hamad 45, Milonair, wir machen mit Abiad Massari Nein! Wir sind keine MCs Wir sind der Alptraum, den du im Benz siehst Es geht vom Hafen bis nach Nordrhein-Westfalen Deutscher Rap, diese Nutte muss den Bordstein bezahlen Ah, Illegal, Azzlack-Harami Cocktails, cok Haze, samstags auf Party Mit Hamad und Ali Drogendealer, Oberliga, Abiat Massari Maserati, Silber in Matt Milonair ich bin das Bild dieser Stadt Die Lichter der Nacht, sündhafte Nächte Kein Problem für mich dein Rückgrat zu brechen Die Connection nach Westdeutschland Scheiß drauf was war, jetzt fängt Rap neu an Neumann Mikrofon Azzlack Motherfuck‘, mieser Flow Scheiß auf dein Pipa Po Was für Gelb oder Grün, ich will Lila cho! Azzlack-Harami Hamad 45, Milonair, wir machen mit Abiad Massari Doppel H, Ruhrpott regieren Für jeden der Krieg will, glaub mir wir schießen Azzlack-Harami Hamad 45, Milonair, wir machen mit Abiad Massari Nein! Wir sind keine MCs Wir sind der Alptraum, den du im Benz siehst Ich hol jeden Cent raus bevor ich in den Knast muss Für einen schwarzen Benzer brauch ich kein Abschluss Fick den Staat, ich bin der Gegenpol In meiner Gegend tauscht man Wasser gegen Brot Yeah, jetzt vom Pott bis nach Hamburg Laufen Haramis mit dem Kopf durch die Wand durch Also scheiß drauf wen du kennst Ich bin Libanese und habe ca. 3000 Cousins Bruder jeder in Deutschland kann zugucken Ich lasse jeden Gangster Rapper heute Blut spucken Es geht vom Ruhrpott bis in den Norden hoch Wir nehmen uns heute was wir wollen, denn wir sind morgen tot Scheiß auf Obama und auf Osama Scheiß auf Merkel, ich mach weiter mit Koks Para Ghetto Déjà-vu Ich sehe Bullen vorbei fahren und schrei A.C.A.B., Fils du Pute Azzlack-Harami Hamad 45, Milonair, wir machen mit Abiad Massari Doppel H, Ruhrpott regieren Für jeden der Krieg will, glaub mir wir schießen Azzlack-Harami Hamad 45, Milonair, wir machen mit Abiad Massari Nein! Wir sind keine MCs Wir sind der Alptraum, den du im Benz siehst",4nwm9VAwFZhofaWrT2HYRb,AMG,2014-03-21,1qXg9ck25tBRxeXsj8mbDG,rap,gangster rap,de,"Azzlack Harami-Milonair-Azzlack-Harami Hamad 45, Milonair, wir machen mit Abiad Massari Doppel H, Ruhrpott regieren Für jeden der Krieg will, glaub mir wir schießen Azzlack-Harami Hamad 45, Milonair, wir machen mit Abiad Massari Nein! Wir sind keine MCs Wir sind der Alptraum, den du im Benz siehst Es geht vom Hafen bis nach Nordrhein-Westfalen Deutscher Rap, diese Nutte muss den Bordstein bezahlen Ah, Illegal, Azzlack-Harami Cocktails, cok Haze, samstags auf Party Mit Hamad und Ali Drogendealer, Oberliga, Abiat Massari Maserati, Silber in Matt Milonair ich bin das Bild dieser Stadt Die Lichter der Nacht, sündhafte Nächte Kein Problem für mich dein Rückgrat zu brechen Die Connection nach Westdeutschland Scheiß drauf was war, jetzt fängt Rap neu an Neumann Mikrofon Azzlack Motherfuck‘, mieser Flow Scheiß auf dein Pipa Po Was für Gelb oder Grün, ich will Lila cho! Azzlack-Harami Hamad 45, Milonair, wir machen mit Abiad Massari Doppel H, Ruhrpott regieren Für jeden der Krieg will, glaub mir wir schießen Azzlack-Harami Hamad 45, Milonair, wir machen mit Abiad Massari Nein! Wir sind keine MCs Wir sind der Alptraum, den du im Benz siehst Ich hol jeden Cent raus bevor ich in den Knast muss Für einen schwarzen Benzer brauch ich kein Abschluss Fick den Staat, ich bin der Gegenpol In meiner Gegend tauscht man Wasser gegen Brot Yeah, jetzt vom Pott bis nach Hamburg Laufen Haramis mit dem Kopf durch die Wand durch Also scheiß drauf wen du kennst Ich bin Libanese und habe ca. 3000 Cousins Bruder jeder in Deutschland kann zugucken Ich lasse jeden Gangster Rapper heute Blut spucken Es geht vom Ruhrpott bis in den Norden hoch Wir nehmen uns heute was wir wollen, denn wir sind morgen tot Scheiß auf Obama und auf Osama Scheiß auf Merkel, ich mach weiter mit Koks Para Ghetto Déjà-vu Ich sehe Bullen vorbei fahren und schrei A.C.A.B., Fils du Pute Azzlack-Harami Hamad 45, Milonair, wir machen mit Abiad Massari Doppel H, Ruhrpott regieren Für jeden der Krieg will, glaub mir wir schießen Azzlack-Harami Hamad 45, Milonair, wir machen mit Abiad Massari Nein! Wir sind keine MCs Wir sind der Alptraum, den du im Benz siehst-rap-gangster rap"
05SgVqTnF4qEMvKSGPeRSD,Ich Binnezz,Bonez MC,"Diggah richtig fies Sub-Sub-Subwoofer Bass pumpt richtig tief Ficker für die Enemies Flagge aus'm Autofenster find ich mies Boomshalaklak wer macht Umsatz bei Nacht Yo, Baga mit der Tasche voller funkelnder Buds Kapuziner, Mandrill unfassbar krass Herz pumpt 808 wie ein Untergangsbass Dass er diese Schiene ernsthaft fährt Man ich glaube die Musik hat sein Gehirn zerstört Guck in Spiegel sag für mich ist dieser Kerl was wert Denn der Typ strahlt aus wie ein Kernkraftwerk Menschen werden nicht durch ihre Gegend zugekifft Du hast keine Meinung solange du nicht weißt wer du bist Mieses Genie wir waren nie so wie die Hamburger Rapper reden von Melancholie (tss) Capa Zeen MC Mehrfach gespaltet so wie'n Schizophrenie Doch ich bleib Untergrund mit paar hundert Jungs Wenn wir kommen wird es schon mal bunt unter uns Niemand hält den Hunger stumm Denn wir lungern und betteln mit unseren Nummern rum Restart 187ers zweifeln niemals an der Ziehkraft meiner Features wie krass Magazin lad nach Capa schießt scharf und verteile dich in Splittergruppen wie Glas Kaum Kraut aber viel Gras wenn ich sie knarz Von dem Zwiespalt ich glaub ich schieb hart auf den Streets nachts Kleben geblieben wie Epoxidharz Ja ich bin es Capa Zeen Gar nichts schlimmes Blasphemie Alles Schnackers Labbern viel Motherfuckers Fantasie Meine Kette so dick sie drückt aufs Genick Ihr Arsch so fett sie strippt nur für mich Diese Nutte zieht die Blicke auf sich Bitte fass mich nicht an geh zurück auf dein Tisch Bonez, guck es ist wie es ist Bis zum jüngsten Gericht mach ich Buisness mit Gift Und nehm keine Rücksicht auf Nichts Kippe Essig auf Fisch und die Chips Halte es unten mit C-A-P-U-Z Wir machen Geld so wie Beate Uhse Observationen verfehlte Versuche Wir lassen sie stehen wie Reeperbahn-Huren Geh mal zur Schule Vorbildfunktionen (pff) Kofferraum voll mit Kanonen Nein, uns kann der Teufel nicht holen Wir wollen die Millionen und goldene Kronen Gehirn verklebt, meine Lunge ein Wrack Ich fress euch am Stück dieser Junge macht Schnapp Die Sonne im Rücken, die Wumme am Sack Klick Klack dein Puller wird schlapp Trage die TN's Fahr durch die Gegend Haken geben, Schlag auf dein Schädel Hase kleben, Spaß mit dein Mädchen Lass sie blasen und gehen Spar dir das Reden du solltest dich schämen Hamburg-West Bahrenfeld da wo wir leben Bargeld bewegen, die Straße am beben Beten, keine Zeit Schafe zu zählen Krokodile, sie lauern dir auf Pitbulls trainieren und powern sich aus Junkies am schwitzen mit Kauer sind drauf Deutscher Rap nur ein Fake so wie Bauer sucht Frau Ja ich bin es BonezMC Das nichts schlimmes Heroin Alles Schnackers Labbern viel Motherfuckers Fantasie",5kKT15JpM6115Bi4GUPSDb,Sampler 3,2015-01-30,5GA8GDo7RQC3JEanT81B3g,rap,gangster rap,de,"Ich Binnezz-Bonez MC-Diggah richtig fies Sub-Sub-Subwoofer Bass pumpt richtig tief Ficker für die Enemies Flagge aus'm Autofenster find ich mies Boomshalaklak wer macht Umsatz bei Nacht Yo, Baga mit der Tasche voller funkelnder Buds Kapuziner, Mandrill unfassbar krass Herz pumpt 808 wie ein Untergangsbass Dass er diese Schiene ernsthaft fährt Man ich glaube die Musik hat sein Gehirn zerstört Guck in Spiegel sag für mich ist dieser Kerl was wert Denn der Typ strahlt aus wie ein Kernkraftwerk Menschen werden nicht durch ihre Gegend zugekifft Du hast keine Meinung solange du nicht weißt wer du bist Mieses Genie wir waren nie so wie die Hamburger Rapper reden von Melancholie (tss) Capa Zeen MC Mehrfach gespaltet so wie'n Schizophrenie Doch ich bleib Untergrund mit paar hundert Jungs Wenn wir kommen wird es schon mal bunt unter uns Niemand hält den Hunger stumm Denn wir lungern und betteln mit unseren Nummern rum Restart 187ers zweifeln niemals an der Ziehkraft meiner Features wie krass Magazin lad nach Capa schießt scharf und verteile dich in Splittergruppen wie Glas Kaum Kraut aber viel Gras wenn ich sie knarz Von dem Zwiespalt ich glaub ich schieb hart auf den Streets nachts Kleben geblieben wie Epoxidharz Ja ich bin es Capa Zeen Gar nichts schlimmes Blasphemie Alles Schnackers Labbern viel Motherfuckers Fantasie Meine Kette so dick sie drückt aufs Genick Ihr Arsch so fett sie strippt nur für mich Diese Nutte zieht die Blicke auf sich Bitte fass mich nicht an geh zurück auf dein Tisch Bonez, guck es ist wie es ist Bis zum jüngsten Gericht mach ich Buisness mit Gift Und nehm keine Rücksicht auf Nichts Kippe Essig auf Fisch und die Chips Halte es unten mit C-A-P-U-Z Wir machen Geld so wie Beate Uhse Observationen verfehlte Versuche Wir lassen sie stehen wie Reeperbahn-Huren Geh mal zur Schule Vorbildfunktionen (pff) Kofferraum voll mit Kanonen Nein, uns kann der Teufel nicht holen Wir wollen die Millionen und goldene Kronen Gehirn verklebt, meine Lunge ein Wrack Ich fress euch am Stück dieser Junge macht Schnapp Die Sonne im Rücken, die Wumme am Sack Klick Klack dein Puller wird schlapp Trage die TN's Fahr durch die Gegend Haken geben, Schlag auf dein Schädel Hase kleben, Spaß mit dein Mädchen Lass sie blasen und gehen Spar dir das Reden du solltest dich schämen Hamburg-West Bahrenfeld da wo wir leben Bargeld bewegen, die Straße am beben Beten, keine Zeit Schafe zu zählen Krokodile, sie lauern dir auf Pitbulls trainieren und powern sich aus Junkies am schwitzen mit Kauer sind drauf Deutscher Rap nur ein Fake so wie Bauer sucht Frau Ja ich bin es BonezMC Das nichts schlimmes Heroin Alles Schnackers Labbern viel Motherfuckers Fantasie-rap-gangster rap"
075NNuZU6IxC7Us3L7ylep,Guardia Civil,Reda Rwena,"Reda Rwena, 069, Main Park, wahya, wahya Sahbi, fick das System, stell die Welt auf den Kopf Erst die K7abs oder Stresuiloius oder's Geld, was mich robbt Sahbo, gib ihm bös, 3amr l'pako Red' nicht am Handy, Kahba, pump' es im Auto Ich hau' die Kgs auf Schlauchboot und bring' es zum gegenüberliegenden Strand hoch Also, was für Mafia, Habibi? Ich komm' im Audi TT und schmier' Guardia Civil Reda mit dem Reggada-Flow Fick' deutschen Rap, yen3al din babahoum Jbed, denn ich komm' mit Brate und DOE Ich starte die Show, entladen und boom!Jbed Sahbo, ich sammel' Batzen, Millen ein Und bei ta7chich hau' ich ganze Kippe rein 069, ich bin Offenbacher, che Pack' die Packs ab bis ich Geld hab' und ich Batzen lila seh', Reda Rwe Sahbo, red' nicht am Handy Tijara fi l'imirat, Mercedes und Bentley Also Habiba Diale Ana dima kan brik, verkauft Twizzla, Haschisch Eh, Sahbi, Guardia Civil Pack' das Koks, streck' den Stein, mach' aus vier Dingern sechs Eh, ich wollte raus aus dem Loch Doch mein Weg führt nicht weg, sondern direkt in 'n Bau He, ich wollt' von Mainpark bis Las Vegas Tmenyet auf Kopf hauen doch kam anders, frag Reda Eh, es ist Guardia Civil, Guardia Civil Sahbo, 3amr w zid '88, Marktplatz, mittlerweile zwanzig-siebzehn Haschplatten fliegen durch die Luft, hier dealst du Jay mit vierzehn Du nimmst sie selbst mit fünfzehn, fünfzehn Jahre lang auf Koka Nächte waren lang, verlor den Faden früh, sah keinen Ausgang Check, ich geb' dir Bretter, bis du fällst, Diggi Ich nimm dein' Frau und dein Geld mit mir Und wenn's nicht klappt, hol' ich die Scharfe Komm' mit dreihundert Kanaken auf Tabletten, zid f'chari3, Pisser Rapper reden viel, doch keiner macht's wie wir Schieben Beef, nur im Netz, kurz vor sei'm Release Ich fick' auf jeden Hype, ich bin mit keinem Freund Ganz weit weg, andere Welt, Offenbach am Stein Wegen Zehnerpacks nicht mal zehn Gramm Steh'n grad fünfzehn Mann blau vor mir Ich sag' kein Plan, scheiß drauf, ist mir eh egal Geb' Gas, links rein, geradeaus, heb' ab Eh, Sahbi, Guardia Civil Pack' das Koks, streck' den Stein, mach' aus vier Dingern sechs Eh, ich wollte raus aus dem Loch Doch mein Weg führt nicht weg, sondern direkt in 'n Bau He, ich wollt' von Mainpark bis Las Vegas Tmenyet auf Kopf hauen doch kam anders, frag Reda Eh, es ist Guardia Civil, Guardia Civil Sahbo, 3amr w zid Bringe den Mocro-Flow dimbabak und ich klatsch' Rapper Hol mir, wen du willst, dann mach, denn es folgen Bleitreffer Jeder meiner Kunden ist ein stadtbekannter Feinschmecker Press' bis zum Limit wie ein abgefuckter Beinstrecker Das Herz von der Straße und pump' es in die Bose-Boxen Robbe mich mit großen Ochsen, treffe mich mit Drogenbossen Entweder fließt Blut oder Bares auf Beton Egal, wie du's siehst, che, die Straße hat gewonn'n Ich trag' 'ne Audemars Arnold Schwarzenegger Bin bei Palaver am Ort Bleiträger Ich bin Panama-Weißgold-Preisgeber, frag Reda Mach lila, ich bin ein anderes Kaliber 45.000 Uhr am Armgelenk Ich mach' Patte mit Musik, doch verdoppel, wenn ich Platten press' Und ich vervierfach', wenn ich Ware streck', was ist Rap? Knarre: check, sonst geb' ich keine Taschen weg Eh, Sahbi, Guardia Civil Pack' das Koks, streck' den Stein, mach' aus vier Dingern sechs Eh, ich wollte raus aus dem Loch Doch mein Weg führt nicht weg, sondern direkt in 'n Bau He, ich wollt' von Mainpark bis Las Vegas Tmenyet auf Kopf hauen doch kam anders, frag Reda Eh, es ist Guardia Civil, Guardia Civil Sahbo, 3amr w zid",4hoCKkdZDb05MhMeOZeDCn,Guardia Civil,2017-09-13,1qXg9ck25tBRxeXsj8mbDG,rap,gangster rap,de,"Guardia Civil-Reda Rwena-Reda Rwena, 069, Main Park, wahya, wahya Sahbi, fick das System, stell die Welt auf den Kopf Erst die K7abs oder Stresuiloius oder's Geld, was mich robbt Sahbo, gib ihm bös, 3amr l'pako Red' nicht am Handy, Kahba, pump' es im Auto Ich hau' die Kgs auf Schlauchboot und bring' es zum gegenüberliegenden Strand hoch Also, was für Mafia, Habibi? Ich komm' im Audi TT und schmier' Guardia Civil Reda mit dem Reggada-Flow Fick' deutschen Rap, yen3al din babahoum Jbed, denn ich komm' mit Brate und DOE Ich starte die Show, entladen und boom!Jbed Sahbo, ich sammel' Batzen, Millen ein Und bei ta7chich hau' ich ganze Kippe rein 069, ich bin Offenbacher, che Pack' die Packs ab bis ich Geld hab' und ich Batzen lila seh', Reda Rwe Sahbo, red' nicht am Handy Tijara fi l'imirat, Mercedes und Bentley Also Habiba Diale Ana dima kan brik, verkauft Twizzla, Haschisch Eh, Sahbi, Guardia Civil Pack' das Koks, streck' den Stein, mach' aus vier Dingern sechs Eh, ich wollte raus aus dem Loch Doch mein Weg führt nicht weg, sondern direkt in 'n Bau He, ich wollt' von Mainpark bis Las Vegas Tmenyet auf Kopf hauen doch kam anders, frag Reda Eh, es ist Guardia Civil, Guardia Civil Sahbo, 3amr w zid '88, Marktplatz, mittlerweile zwanzig-siebzehn Haschplatten fliegen durch die Luft, hier dealst du Jay mit vierzehn Du nimmst sie selbst mit fünfzehn, fünfzehn Jahre lang auf Koka Nächte waren lang, verlor den Faden früh, sah keinen Ausgang Check, ich geb' dir Bretter, bis du fällst, Diggi Ich nimm dein' Frau und dein Geld mit mir Und wenn's nicht klappt, hol' ich die Scharfe Komm' mit dreihundert Kanaken auf Tabletten, zid f'chari3, Pisser Rapper reden viel, doch keiner macht's wie wir Schieben Beef, nur im Netz, kurz vor sei'm Release Ich fick' auf jeden Hype, ich bin mit keinem Freund Ganz weit weg, andere Welt, Offenbach am Stein Wegen Zehnerpacks nicht mal zehn Gramm Steh'n grad fünfzehn Mann blau vor mir Ich sag' kein Plan, scheiß drauf, ist mir eh egal Geb' Gas, links rein, geradeaus, heb' ab Eh, Sahbi, Guardia Civil Pack' das Koks, streck' den Stein, mach' aus vier Dingern sechs Eh, ich wollte raus aus dem Loch Doch mein Weg führt nicht weg, sondern direkt in 'n Bau He, ich wollt' von Mainpark bis Las Vegas Tmenyet auf Kopf hauen doch kam anders, frag Reda Eh, es ist Guardia Civil, Guardia Civil Sahbo, 3amr w zid Bringe den Mocro-Flow dimbabak und ich klatsch' Rapper Hol mir, wen du willst, dann mach, denn es folgen Bleitreffer Jeder meiner Kunden ist ein stadtbekannter Feinschmecker Press' bis zum Limit wie ein abgefuckter Beinstrecker Das Herz von der Straße und pump' es in die Bose-Boxen Robbe mich mit großen Ochsen, treffe mich mit Drogenbossen Entweder fließt Blut oder Bares auf Beton Egal, wie du's siehst, che, die Straße hat gewonn'n Ich trag' 'ne Audemars Arnold Schwarzenegger Bin bei Palaver am Ort Bleiträger Ich bin Panama-Weißgold-Preisgeber, frag Reda Mach lila, ich bin ein anderes Kaliber 45.000 Uhr am Armgelenk Ich mach' Patte mit Musik, doch verdoppel, wenn ich Platten press' Und ich vervierfach', wenn ich Ware streck', was ist Rap? Knarre: check, sonst geb' ich keine Taschen weg Eh, Sahbi, Guardia Civil Pack' das Koks, streck' den Stein, mach' aus vier Dingern sechs Eh, ich wollte raus aus dem Loch Doch mein Weg führt nicht weg, sondern direkt in 'n Bau He, ich wollt' von Mainpark bis Las Vegas Tmenyet auf Kopf hauen doch kam anders, frag Reda Eh, es ist Guardia Civil, Guardia Civil Sahbo, 3amr w zid-rap-gangster rap"
0al9yd2pRDUY7GIYUnlxH3,Schreibe mein Schicksal,Haze,"Kum moved auf Album Ich nehm richtig dicken durst mit Kein zurück nach Disneyland wo Mickey, Minnie durchfickt Die Zigeunerin hat recht gehabt Bald ist mein Name überall zu sehen von Wien bis in die Fächerstadt Denk daran die Combo, ist Klassik wie Chardé Amar, Haze, Svaba, ey - Pavle, David i Andrej Mit 'nem Blick in dein Gesicht, Puto lass ich dich verstehen Frag mich lieber nach Paket, denn sonst sag ich dir Ade Deutscher Rap sitzt mit zehn, zwanzig Abis im Café Doch mein Abi ist aus Stahl und er fragt dich nicht was geht Und auf Montenegros Ghettos Bruder platz ich in das Game Selbst dein Schutzengel wird dich für ein Gramm hier hintergehen Mir egal ob du Fame oder ein paar Klickzahlen besitzt Selbst mein Sternzeichen hat ein verdammten Giftschwanz der sticht Hab kein Wikipedia doch steh in fremden Wikis drinne' Press mein ganzes Blut und meine Schmerzen in die Stimme Du willst den wahren Scheiß, kein Problem, kriegst du glatt Ich schreib mein Schicksal selber - gib mir nur ein Stift und Blatt Mein Weg als MC, Bruder wird mir nie zu lang Und wenn ich sterben sollte, sterbe ich mit dem Beat zusammen Dann sterbe ich mit dem Beat zusammen Dann sterbe ich mit dem Beat zusammen Dann sterbe ich mit dem Beat zusammen Dann sterbe ich mit dem Beat zusammen Die Zigeunerin hat Recht gehabt Ich bin dem Tod entkommen, Pech gehabt Hab nicht umsonst ein Kreuz an meiner Kette dran Kenn' den Sensenmann, die Stadt sie leuchtet wie beim Flächenbrand Rote Flammen, blaue Flammen räuchert sich in Haze Gestank Die Milz ist raus, ich mach trotz alle dem noch immer die Becher platt Eksaj brate kroatischer Kenner-Schnaps Ich häng in hohen Häusern in den Kellern ab Trenerka und Terrier ausm Ostblock dicka Jebiga In meinem Leben da läuft es nicht geregelt ab Dreh des Matt schon morgens, weil ich Leute sonst nicht sehen kann Des regt mich ab und ich schreib meine Parts dann Denn ich reime schon seit damals, als die Preise noch in Mark waren Reime schon seit damals als Freestyle angesagt war Bevor ich 8-Mile ansah, vor langer Zeit mal Keine Cypher, Asylanten und Gastarbeiter Deren kleine Kinder fanden auf der Straße eine Heimat A šta je sad? Hajde nimm ein Zug wie High es macht Doch die Kurse bleiben schwach guter Fuffi eins acht Das söllige beim Jugo und beim Turčin harter Taş Bleibe wach Brate moj die ganze Nacht Zeko Du willst den wahren Scheiß, kein Problem, kriegst du glatt Ich schreib mein Schicksal selber - gib mir nur ein Stift und Blatt Mein Weg als MC, Bruder wird mir nie zu lang Und wenn ich sterben sollte, sterbe ich mit dem Beat zusammen Dann sterbe ich mit dem Beat zusammen Dann sterbe ich mit dem Beat zusammen Dann sterbe ich mit dem Beat zusammen Dann sterbe ich mit dem Beat zusammen Amarilo, Haze und Svaba Flows und Skills sind auf Lager, der Rest ist mager Abra Kadabra diese Motherfucker, machen einen auf ich bin Vater Alles Versager, niente nada kein können kein Talent Wir sind Frates von der Straße und wir rennen Lass diese Kellerasseln brenn wir sind schneller als der Wind Was für Teller waschen? Und sie fragen wer ich bin Bruder Svaba sag mal bitte schämen die sich nicht Bruder? Ich bin wer ich bin Bruder Und wer bist du, hah? - Ich bin 'n Bruder Rap ist keine Modeshow Und jeder der hier Rap liebt kennt mich Armageddon Todes-Flow Rhyme-Killer, sie träumen von Weinkeller Machen einen auf Freund aber sind professionelle Beinsteller Du willst den wahren Scheiß, kein Problem, kriegst du glatt Ich schreib mein Schicksal selber - gib mir nur ein Stift und Blatt Mein Weg als MC, Bruder wird mir nie zu lang Und wenn ich sterben sollte, sterbe ich mit dem Beat zusammen Dann sterbe ich mit dem Beat zusammen Dann sterbe ich mit dem Beat zusammen Dann sterbe ich mit dem Beat zusammen Dann sterbe ich mit dem Beat zusammen",6nJ0VLzw8vrwrG4UBRBkh0,Die Zwielicht LP,2018-02-16,1qXg9ck25tBRxeXsj8mbDG,rap,gangster rap,de,"Schreibe mein Schicksal-Haze-Kum moved auf Album Ich nehm richtig dicken durst mit Kein zurück nach Disneyland wo Mickey, Minnie durchfickt Die Zigeunerin hat recht gehabt Bald ist mein Name überall zu sehen von Wien bis in die Fächerstadt Denk daran die Combo, ist Klassik wie Chardé Amar, Haze, Svaba, ey - Pavle, David i Andrej Mit 'nem Blick in dein Gesicht, Puto lass ich dich verstehen Frag mich lieber nach Paket, denn sonst sag ich dir Ade Deutscher Rap sitzt mit zehn, zwanzig Abis im Café Doch mein Abi ist aus Stahl und er fragt dich nicht was geht Und auf Montenegros Ghettos Bruder platz ich in das Game Selbst dein Schutzengel wird dich für ein Gramm hier hintergehen Mir egal ob du Fame oder ein paar Klickzahlen besitzt Selbst mein Sternzeichen hat ein verdammten Giftschwanz der sticht Hab kein Wikipedia doch steh in fremden Wikis drinne' Press mein ganzes Blut und meine Schmerzen in die Stimme Du willst den wahren Scheiß, kein Problem, kriegst du glatt Ich schreib mein Schicksal selber - gib mir nur ein Stift und Blatt Mein Weg als MC, Bruder wird mir nie zu lang Und wenn ich sterben sollte, sterbe ich mit dem Beat zusammen Dann sterbe ich mit dem Beat zusammen Dann sterbe ich mit dem Beat zusammen Dann sterbe ich mit dem Beat zusammen Dann sterbe ich mit dem Beat zusammen Die Zigeunerin hat Recht gehabt Ich bin dem Tod entkommen, Pech gehabt Hab nicht umsonst ein Kreuz an meiner Kette dran Kenn' den Sensenmann, die Stadt sie leuchtet wie beim Flächenbrand Rote Flammen, blaue Flammen räuchert sich in Haze Gestank Die Milz ist raus, ich mach trotz alle dem noch immer die Becher platt Eksaj brate kroatischer Kenner-Schnaps Ich häng in hohen Häusern in den Kellern ab Trenerka und Terrier ausm Ostblock dicka Jebiga In meinem Leben da läuft es nicht geregelt ab Dreh des Matt schon morgens, weil ich Leute sonst nicht sehen kann Des regt mich ab und ich schreib meine Parts dann Denn ich reime schon seit damals, als die Preise noch in Mark waren Reime schon seit damals als Freestyle angesagt war Bevor ich 8-Mile ansah, vor langer Zeit mal Keine Cypher, Asylanten und Gastarbeiter Deren kleine Kinder fanden auf der Straße eine Heimat A šta je sad? Hajde nimm ein Zug wie High es macht Doch die Kurse bleiben schwach guter Fuffi eins acht Das söllige beim Jugo und beim Turčin harter Taş Bleibe wach Brate moj die ganze Nacht Zeko Du willst den wahren Scheiß, kein Problem, kriegst du glatt Ich schreib mein Schicksal selber - gib mir nur ein Stift und Blatt Mein Weg als MC, Bruder wird mir nie zu lang Und wenn ich sterben sollte, sterbe ich mit dem Beat zusammen Dann sterbe ich mit dem Beat zusammen Dann sterbe ich mit dem Beat zusammen Dann sterbe ich mit dem Beat zusammen Dann sterbe ich mit dem Beat zusammen Amarilo, Haze und Svaba Flows und Skills sind auf Lager, der Rest ist mager Abra Kadabra diese Motherfucker, machen einen auf ich bin Vater Alles Versager, niente nada kein können kein Talent Wir sind Frates von der Straße und wir rennen Lass diese Kellerasseln brenn wir sind schneller als der Wind Was für Teller waschen? Und sie fragen wer ich bin Bruder Svaba sag mal bitte schämen die sich nicht Bruder? Ich bin wer ich bin Bruder Und wer bist du, hah? - Ich bin 'n Bruder Rap ist keine Modeshow Und jeder der hier Rap liebt kennt mich Armageddon Todes-Flow Rhyme-Killer, sie träumen von Weinkeller Machen einen auf Freund aber sind professionelle Beinsteller Du willst den wahren Scheiß, kein Problem, kriegst du glatt Ich schreib mein Schicksal selber - gib mir nur ein Stift und Blatt Mein Weg als MC, Bruder wird mir nie zu lang Und wenn ich sterben sollte, sterbe ich mit dem Beat zusammen Dann sterbe ich mit dem Beat zusammen Dann sterbe ich mit dem Beat zusammen Dann sterbe ich mit dem Beat zusammen Dann sterbe ich mit dem Beat zusammen-rap-gangster rap"
