track_id,track_name,track_artist,lyrics,track_album_id,track_album_name,track_album_release_date,playlist_id,playlist_genre,playlist_subgenre,language,concatenated
0LMdYkvJ4gcNr3d0D5dnt1,Realtalk Infinity,Jigzaw,"„Eigentlich hätte er längst aus Deutschland ausgereist sein soll'n. Nusan C. alias Jigzaw, selbsternannter Gangsterrapper, der über Drogen und die Zeit im Knast rappt. Jetzt sucht die Polizei nachdem türkischen Staatsbürger, Grund: der dreiundzwanzig Jährige soll einen Mann niedergestochen haben.“ Yeah, ich hab' gehört Deutschland sucht nach mir? Ja, dann such mal weiter Ich piss' euch noch kurz an bevor ich weg bin Yeah Das ist Jiggijo, die Mordkommission, sie ermittelt Zeitungen berichten, Jigzaw ist am vernichten Meine Fresse auf Plakaten von fünf-acht bis Berlin-Mitte Sag der BILD, SAT.1 und der FDP, sie könn'n sich ficken Lak, vom Staat abgestempelt, Asyltrickser und Gangsterrapper Er spricht mein'n Namen falsch aus, der Nachrichtensprecher Sie jagen mich, ich leb' mein Leben, guck, jetzt geht's mir besser Über fünfzehn Länder auf Flucht, schwenk' das Mic wie Teppichmesser Ah, wir kam'n der Sonne viel zu nah (yeah) Sie testen mich, sie woll'n mein Hak, das jedes Mal (jedes Mal) Doch nicht mit mir, wer ist am Wilhelmsplatz der Star? Arme, Hände voll vernarbt, Jiggi Conan der Barbar Fick dein Testopropionat und Jiggi fickt eure Mütter hart Der Türke belieferte Coffeeshops bis zum Calwermarkt Mit einem Katana, hundert Prozent Disrespekt Vater Staat Ich baller' hart und fick' Hagen grad hier vor Kameras Ya hero ya mero, hart auf hart, Teufelsadvokat Ich ratter' Parts, bin von der Straße, kein'n Plan von à la carte Ich bin auf Flucht und ficke Brenna ein andermal MoTrip die Nutte ist der Nächste, dieser Part bremst dich Ist wie Chilli-Cheese-Essen, es wird für dein'n Arsch brenzlig Ich kauf' für vier und geb' dir acht, sechzig Bullen jagen mich nachts wie Djinns, als wär' ich Van Helsing Carolina suckt, Transport durch das Niederland Packte mit Karat Kilos ab, ich komm' in fünf Jahr'n wieder, Mann Während der eine siebzig Mio Klicks durch Kokaina macht Sitzt der andre Untersuchungshaft in Peru Lima ab Lak, ich ficke eure Gangs, Zuna braucht nicht kommentier'n Ich bin ein Gönner und kaufte somit die Alben auch von dir Nash hat sich informiert, doch die Scheiße provoziert Redet mit andern über mich, doch Nash redet nicht mit mir Wer verteilt, muss auch kassier'n, weil die Bull'n observier'n Bin ich auf Flucht, während sie mit fünf Leuten Singles komponier'n Bruder, glaubt mir, wir sind zu echt Nicht resozialisiert und zu brutal für das Geschäft Es macht mir einiges kaputt, dieser Hass, was in mich steckt Das ist nicht einfach so gerappt, so viel Blut haben wir geleckt Ich bin nicht mal bisschen wie die, komm mit mir oder bleib weg Ficken gegenseitig ihre Mütter und abends auf korrekt Blutrache, ich war weg für paar Jahre, wer ist echt? Viereinhalb Jahre kassiert, eure Zeil'n bleiben wack Denn wenn du eine Person aus meiner Familie weinen lässt Sei dir sicher, dass der erste Schuss von unsrer Seite fällt Wir hab'n verteilt und eingesteckt, gestochen in Seiten, denn Zu Zeiten als die Nutten an uns noch zweifelten War'n die Zeilen schon echt und so scharf wie Bleikugeln Ich hab' dicken Yarak für die, die mit mir Streit suchen Captain Hook ist eine Hure und Brenna eine Hure Gorex eine Hure und Momonews eine Hure Ich komm' dahin, wo ihr wollt, alleine, nur falls ihr mich sucht Dein Testo dämpft mei'n Schlag ... aber keine Kugel Die ersten und die letzten Zeil'n, die ich auf euch schieße Auf euch warte ein Zuhause, auf mich schwedische Gardin'n Deshalb keine Zeit für euch, ihr seid nur Vögel, die mich nerven Keine Löwen, nur paar Nerzen, lak, ich häute euch mit Scherben Ich töte, bevor ich sterbe, bis Bäche hier Rot gefärbt ist Bis Azrael totgenervt geflogen kommt auf die Erde Greifen hier nach den Sternen, hoch lebe die Merkel Fick die Welt, weil wir so wie so wie im Zoo eingesperrt sind Teil' die Beute mit Ismail, Ayoub, Kerem und Abdul Außer Hurricane und mir gibt es in Hagen keine Rapper Millionär in der Türkei, mit Werdegang eines Verbrechers Es ist noch lange nicht vorbei Der Staatsanwalt guckt jetzt zwischen mein'n Zeil'n 2-18, ich hole mir mein'n Hype Und verkauf' aus der Türkei, digital im deutschen Reich Ihr klein'n verfickten Wichser. An alle klein'n Missgeburten, die Missgunst wünschen, die mir Lebenslang wünschen, lak, ihr kleinen Fotzen. Ihr wisst noch nicht mal aus welcher Fotze ihr gekrochen seid. Geht blasen!",6NyvXgtYTjfUTmbd8QBu2x,Realtalk Infinity,2018-01-19,1qXg9ck25tBRxeXsj8mbDG,rap,gangster rap,de,"Realtalk Infinity-Jigzaw-„Eigentlich hätte er längst aus Deutschland ausgereist sein soll'n. Nusan C. alias Jigzaw, selbsternannter Gangsterrapper, der über Drogen und die Zeit im Knast rappt. Jetzt sucht die Polizei nachdem türkischen Staatsbürger, Grund: der dreiundzwanzig Jährige soll einen Mann niedergestochen haben.“ Yeah, ich hab' gehört Deutschland sucht nach mir? Ja, dann such mal weiter Ich piss' euch noch kurz an bevor ich weg bin Yeah Das ist Jiggijo, die Mordkommission, sie ermittelt Zeitungen berichten, Jigzaw ist am vernichten Meine Fresse auf Plakaten von fünf-acht bis Berlin-Mitte Sag der BILD, SAT.1 und der FDP, sie könn'n sich ficken Lak, vom Staat abgestempelt, Asyltrickser und Gangsterrapper Er spricht mein'n Namen falsch aus, der Nachrichtensprecher Sie jagen mich, ich leb' mein Leben, guck, jetzt geht's mir besser Über fünfzehn Länder auf Flucht, schwenk' das Mic wie Teppichmesser Ah, wir kam'n der Sonne viel zu nah (yeah) Sie testen mich, sie woll'n mein Hak, das jedes Mal (jedes Mal) Doch nicht mit mir, wer ist am Wilhelmsplatz der Star? Arme, Hände voll vernarbt, Jiggi Conan der Barbar Fick dein Testopropionat und Jiggi fickt eure Mütter hart Der Türke belieferte Coffeeshops bis zum Calwermarkt Mit einem Katana, hundert Prozent Disrespekt Vater Staat Ich baller' hart und fick' Hagen grad hier vor Kameras Ya hero ya mero, hart auf hart, Teufelsadvokat Ich ratter' Parts, bin von der Straße, kein'n Plan von à la carte Ich bin auf Flucht und ficke Brenna ein andermal MoTrip die Nutte ist der Nächste, dieser Part bremst dich Ist wie Chilli-Cheese-Essen, es wird für dein'n Arsch brenzlig Ich kauf' für vier und geb' dir acht, sechzig Bullen jagen mich nachts wie Djinns, als wär' ich Van Helsing Carolina suckt, Transport durch das Niederland Packte mit Karat Kilos ab, ich komm' in fünf Jahr'n wieder, Mann Während der eine siebzig Mio Klicks durch Kokaina macht Sitzt der andre Untersuchungshaft in Peru Lima ab Lak, ich ficke eure Gangs, Zuna braucht nicht kommentier'n Ich bin ein Gönner und kaufte somit die Alben auch von dir Nash hat sich informiert, doch die Scheiße provoziert Redet mit andern über mich, doch Nash redet nicht mit mir Wer verteilt, muss auch kassier'n, weil die Bull'n observier'n Bin ich auf Flucht, während sie mit fünf Leuten Singles komponier'n Bruder, glaubt mir, wir sind zu echt Nicht resozialisiert und zu brutal für das Geschäft Es macht mir einiges kaputt, dieser Hass, was in mich steckt Das ist nicht einfach so gerappt, so viel Blut haben wir geleckt Ich bin nicht mal bisschen wie die, komm mit mir oder bleib weg Ficken gegenseitig ihre Mütter und abends auf korrekt Blutrache, ich war weg für paar Jahre, wer ist echt? Viereinhalb Jahre kassiert, eure Zeil'n bleiben wack Denn wenn du eine Person aus meiner Familie weinen lässt Sei dir sicher, dass der erste Schuss von unsrer Seite fällt Wir hab'n verteilt und eingesteckt, gestochen in Seiten, denn Zu Zeiten als die Nutten an uns noch zweifelten War'n die Zeilen schon echt und so scharf wie Bleikugeln Ich hab' dicken Yarak für die, die mit mir Streit suchen Captain Hook ist eine Hure und Brenna eine Hure Gorex eine Hure und Momonews eine Hure Ich komm' dahin, wo ihr wollt, alleine, nur falls ihr mich sucht Dein Testo dämpft mei'n Schlag ... aber keine Kugel Die ersten und die letzten Zeil'n, die ich auf euch schieße Auf euch warte ein Zuhause, auf mich schwedische Gardin'n Deshalb keine Zeit für euch, ihr seid nur Vögel, die mich nerven Keine Löwen, nur paar Nerzen, lak, ich häute euch mit Scherben Ich töte, bevor ich sterbe, bis Bäche hier Rot gefärbt ist Bis Azrael totgenervt geflogen kommt auf die Erde Greifen hier nach den Sternen, hoch lebe die Merkel Fick die Welt, weil wir so wie so wie im Zoo eingesperrt sind Teil' die Beute mit Ismail, Ayoub, Kerem und Abdul Außer Hurricane und mir gibt es in Hagen keine Rapper Millionär in der Türkei, mit Werdegang eines Verbrechers Es ist noch lange nicht vorbei Der Staatsanwalt guckt jetzt zwischen mein'n Zeil'n 2-18, ich hole mir mein'n Hype Und verkauf' aus der Türkei, digital im deutschen Reich Ihr klein'n verfickten Wichser. An alle klein'n Missgeburten, die Missgunst wünschen, die mir Lebenslang wünschen, lak, ihr kleinen Fotzen. Ihr wisst noch nicht mal aus welcher Fotze ihr gekrochen seid. Geht blasen!-rap-gangster rap"
0opxSp0Jw0RgsQBy1qDwNb,Unterwegs,Fler,"Oster on the beat, hehe, watch out! (Polnische Übersetzung/Polska Wersja) Ich bin unterwegs nachts in Berlin Ich hab' kein'n Bock meine Waffe zu zieh'n Ich hab' kein'n Bock meine Waffe zu ziehn'Ich bin heut drauf auf Amphetamin Ich bin unterwegs nachts in Berlin Ich hab' kein'n Bock meine Waffe zu zieh'n Ich hab' kein'n Bock meine Waffe zu zieh'nIch bin heut drauf auf Amphetamin (Polnische Übersetzung/Polska Wersja) Egal, wo ich bin, ich hab' Freunde dabei Manchmal hab' ich ein'n Revolver dabei Ich hab' kein'n Führerschein, doch fahr' den Wagen Ich bin gekomm'n, um dich Opfer zu schlagen Du gibst dem V-Mann ein'n Kuss, du Verräter In Berlin gab's nie so 'ne Schwuchtel wie Kay One Dein Business ist Micky Maus, das ist nicht Disneyland Du bist nicht Booba, nicht Em und nicht 50 Cent Wer hat dich bedroht? Dicka, lass mal die Filme Du redest vorm Richter, du Wichser, doch kriegst dann im Knast keine Hilfe Blut auf deinen weißen Hosen Auf dei'm Grabstein weiße Rosen (Polnische Übersetzung/Polska Wersja) Ich bin unterwegs nachts in Berlin Ich hab' kein'n Bock meine Waffe zu zieh'n Ich hab' kein'n Bock meine Waffe zu ziehn'Ich bin heut drauf auf Amphetamin Ich bin unterwegs nachts in Berlin Ich hab' kein'n Bock meine Waffe zu zieh'n Ich hab' kein'n Bock meine Waffe zu zieh'nIch bin heut drauf auf Amphetamin Du bist am schwitzen, denn du hast mich angezeigt Flizzy macht Welle, wenn er in den Lambo steigt Nutte, komm blasen, denn ich bin dein Märchenprinz Das, was der Bulle sucht, ist in den Air Max drin Red nicht von Ghetto, wenn du in 'nem Penthouse wohnst Nehme die Basey und stürme die Redaktion Ich hab' für jedes Verbrechen ein Alibi Ich war zur Tatzeit besoffen auf Hennessy Rapper wollen lustig sein Ich komm' in den Club nicht rein Du weißt Bescheid, Mann, du Opfer, ich Täter Du weißt Bescheid, Mann, Bottega Veneta (Polnische Übersetzung/Polska Wersja) Ich bin unterwegs nachts in Berlin Ich hab' kein'n Bock meine Waffe zu zieh'n Ich hab' kein'n Bock meine Waffe zu ziehn'Ich bin heut drauf auf Amphetamin Ich bin unterwegs nachts in Berlin Ich hab' kein'n Bock meine Waffe zu zieh'n Ich hab' kein'n Bock meine Waffe zu zieh'nIch bin heut drauf auf Amphetamin",7DURQVofkyZn3AZ302vn15,Unterwegs,2016-02-11,5GA8GDo7RQC3JEanT81B3g,rap,gangster rap,de,"Unterwegs-Fler-Oster on the beat, hehe, watch out! (Polnische Übersetzung/Polska Wersja) Ich bin unterwegs nachts in Berlin Ich hab' kein'n Bock meine Waffe zu zieh'n Ich hab' kein'n Bock meine Waffe zu ziehn'Ich bin heut drauf auf Amphetamin Ich bin unterwegs nachts in Berlin Ich hab' kein'n Bock meine Waffe zu zieh'n Ich hab' kein'n Bock meine Waffe zu zieh'nIch bin heut drauf auf Amphetamin (Polnische Übersetzung/Polska Wersja) Egal, wo ich bin, ich hab' Freunde dabei Manchmal hab' ich ein'n Revolver dabei Ich hab' kein'n Führerschein, doch fahr' den Wagen Ich bin gekomm'n, um dich Opfer zu schlagen Du gibst dem V-Mann ein'n Kuss, du Verräter In Berlin gab's nie so 'ne Schwuchtel wie Kay One Dein Business ist Micky Maus, das ist nicht Disneyland Du bist nicht Booba, nicht Em und nicht 50 Cent Wer hat dich bedroht? Dicka, lass mal die Filme Du redest vorm Richter, du Wichser, doch kriegst dann im Knast keine Hilfe Blut auf deinen weißen Hosen Auf dei'm Grabstein weiße Rosen (Polnische Übersetzung/Polska Wersja) Ich bin unterwegs nachts in Berlin Ich hab' kein'n Bock meine Waffe zu zieh'n Ich hab' kein'n Bock meine Waffe zu ziehn'Ich bin heut drauf auf Amphetamin Ich bin unterwegs nachts in Berlin Ich hab' kein'n Bock meine Waffe zu zieh'n Ich hab' kein'n Bock meine Waffe zu zieh'nIch bin heut drauf auf Amphetamin Du bist am schwitzen, denn du hast mich angezeigt Flizzy macht Welle, wenn er in den Lambo steigt Nutte, komm blasen, denn ich bin dein Märchenprinz Das, was der Bulle sucht, ist in den Air Max drin Red nicht von Ghetto, wenn du in 'nem Penthouse wohnst Nehme die Basey und stürme die Redaktion Ich hab' für jedes Verbrechen ein Alibi Ich war zur Tatzeit besoffen auf Hennessy Rapper wollen lustig sein Ich komm' in den Club nicht rein Du weißt Bescheid, Mann, du Opfer, ich Täter Du weißt Bescheid, Mann, Bottega Veneta (Polnische Übersetzung/Polska Wersja) Ich bin unterwegs nachts in Berlin Ich hab' kein'n Bock meine Waffe zu zieh'n Ich hab' kein'n Bock meine Waffe zu ziehn'Ich bin heut drauf auf Amphetamin Ich bin unterwegs nachts in Berlin Ich hab' kein'n Bock meine Waffe zu zieh'n Ich hab' kein'n Bock meine Waffe zu zieh'nIch bin heut drauf auf Amphetamin-rap-gangster rap"
0Q4UnABWc02jPFQwzx96EJ,Bunker,Sa4,"Ich hab' gute Fünf-Euro-Kurse Mit fünf Kilo Achter im Heck um die Kurve Kein Platz für Verräter, mit Jusef Axt im Carrera Und die Uhr'n, sie sind Achtzehnkaräter Gerüchte kursieren, dass sie Texte kopieren Doch du siehst nur bei den Echten die Geschäfte florieren Weg, weg, yallah, Tek tek, Para Mach' Flex klein, streck' Stein, Shem-Shem Babas Alles in Kauf nehmen, allesamt ausnehmen Kalash zieh'n, raufgeh'n, bis alle Mann draufgeh'n Sorgen für Aufsehen, nimm dir dein'n Hype weg Nimm dir dein Mic weg, Stiche beim Miccheck Hau' dich Schwuchtel weg, denn du schuldest mir Respekt Erst rufst du, „Was ist jetzt?“, danach rufst du das Gesetz Kanaks mit Migrationhintergrund Kalash blitzt, die Patron'n sind geputzt Wir lassen dein'n Bunker platzen, wenn wir in dein'n Bunker platzen Und circa hundert Kapseln plus dein Klunker schnappen Umsatz machen, bunte Batzen, dunkle Gassen Mit Hundertschaften, Bull'n im Nacken Wir lassen deinen Bunker platzen, wenn wir in dein'n Bunker platzen Und circa hundert Kapseln plus dein Klunker schnappen Umsatz machen, bunte Batzen, dunkle Gassen Mit Hundertschaften, Bull'n im Nacken Durch die Hood fahren, mit Mucho im Fluchtwagen Para wird geteilt, so wie Schnupfnasen mit Clubkarten Wir tragen Schusswaffen in Brusttaschen Weil wir nicht ein'n Cent für Schutz zahlen Mit illegalen Substanzen Plus machen Justiz im Nacken, keine Zeit zum Durchatmen Kann nicht ruhig schlafen, jeder will dein Hak wegnehm'n Scheiß auf Reden, einfach Handcheck geben Kickdown, scheiß auf Blitzer und Straßenschilder Hazoticker, im Sprinter sind zwanzig Dinger Wir war'n schon als Kinder im Strafregister Vom MEK abgeführt mit Kabelbinder Fick dein'n Lutscherrap, ich liefer' unbegrenzt Wenn ich Kunden treff', mach' ich schwarz buntes Cash Ich bin schon seit Tag eins unterschätzt Hör mein Tape und du fühlst Wahrheit ungestreckt Wir lassen deinen Bunker platzen, wenn wir in dein'n Bunker platzen Und circa hundert Kapseln plus dein Klunker schnappen Umsatz machen, bunte Batzen, dunkle Gassen Mit Hundertschaften, Bull'n im Nacken Wir lassen dein'n Bunker platzen, wenn wir in dein'n Bunker platzen Und circa hundert Kapseln plus dein Klunker schnappen Umsatz machen, bunte Batzen, dunkle Gassen Mit Hundertschaften, Bull'n im Nacken",1Ql59l5ktSAPyS8q2mYUdZ,Neue deutsche Quelle,2017-11-10,5GA8GDo7RQC3JEanT81B3g,rap,gangster rap,de,"Bunker-Sa4-Ich hab' gute Fünf-Euro-Kurse Mit fünf Kilo Achter im Heck um die Kurve Kein Platz für Verräter, mit Jusef Axt im Carrera Und die Uhr'n, sie sind Achtzehnkaräter Gerüchte kursieren, dass sie Texte kopieren Doch du siehst nur bei den Echten die Geschäfte florieren Weg, weg, yallah, Tek tek, Para Mach' Flex klein, streck' Stein, Shem-Shem Babas Alles in Kauf nehmen, allesamt ausnehmen Kalash zieh'n, raufgeh'n, bis alle Mann draufgeh'n Sorgen für Aufsehen, nimm dir dein'n Hype weg Nimm dir dein Mic weg, Stiche beim Miccheck Hau' dich Schwuchtel weg, denn du schuldest mir Respekt Erst rufst du, „Was ist jetzt?“, danach rufst du das Gesetz Kanaks mit Migrationhintergrund Kalash blitzt, die Patron'n sind geputzt Wir lassen dein'n Bunker platzen, wenn wir in dein'n Bunker platzen Und circa hundert Kapseln plus dein Klunker schnappen Umsatz machen, bunte Batzen, dunkle Gassen Mit Hundertschaften, Bull'n im Nacken Wir lassen deinen Bunker platzen, wenn wir in dein'n Bunker platzen Und circa hundert Kapseln plus dein Klunker schnappen Umsatz machen, bunte Batzen, dunkle Gassen Mit Hundertschaften, Bull'n im Nacken Durch die Hood fahren, mit Mucho im Fluchtwagen Para wird geteilt, so wie Schnupfnasen mit Clubkarten Wir tragen Schusswaffen in Brusttaschen Weil wir nicht ein'n Cent für Schutz zahlen Mit illegalen Substanzen Plus machen Justiz im Nacken, keine Zeit zum Durchatmen Kann nicht ruhig schlafen, jeder will dein Hak wegnehm'n Scheiß auf Reden, einfach Handcheck geben Kickdown, scheiß auf Blitzer und Straßenschilder Hazoticker, im Sprinter sind zwanzig Dinger Wir war'n schon als Kinder im Strafregister Vom MEK abgeführt mit Kabelbinder Fick dein'n Lutscherrap, ich liefer' unbegrenzt Wenn ich Kunden treff', mach' ich schwarz buntes Cash Ich bin schon seit Tag eins unterschätzt Hör mein Tape und du fühlst Wahrheit ungestreckt Wir lassen deinen Bunker platzen, wenn wir in dein'n Bunker platzen Und circa hundert Kapseln plus dein Klunker schnappen Umsatz machen, bunte Batzen, dunkle Gassen Mit Hundertschaften, Bull'n im Nacken Wir lassen dein'n Bunker platzen, wenn wir in dein'n Bunker platzen Und circa hundert Kapseln plus dein Klunker schnappen Umsatz machen, bunte Batzen, dunkle Gassen Mit Hundertschaften, Bull'n im Nacken-rap-gangster rap"
0QKHlkLVjpaJF98RQiL9rR,Manus Manum Lavat,Saltatio Mortis,"Getrieben von Gedanken Die ein and'rer für mich denkt Bau' ich mir einen Galgen An dem ein and'rer für mich hängt Ich leb' an dünnen Drähten Die ein and'rer für mich zieht Doch ich bin eine Puppe Vor der ein Puppenspieler flieht Du lebst für deine Kriege Weil ein and'rer für dich stirbt Erstrahlst in hellem Glanze Indem ein and'rer für dich wirbt Wasch deine Hand in Unschuld Die ein and'rer dir poliert Doch meine Hand bleibt sauber Weil niemand sie mir schmiert Ich beiße lustvoll in die Hand Die mir das Futter reicht Fahr' zornig aus der Haut Vor Ungerechtigkeit Wer ich bin, das gilt nichts mehr Es zählt nur, wen ich kenn' Wer welche Hand gewaschen hat Manus manum lavat Auch meine Hand wird schuldig Schreibt sie euch dieses Lied Mein Finger zeigt ins Dunkel Und auf das, was dort geschieht Auf Lüge und Intrige Korruption und Kungelei Auf die gewasch'nen Hände Doch unsere sind nicht dabei Ich beiße lustvoll in die Hand Die mir das Futter reicht Fahr' zornig aus der Haut Vor Ungerechtigkeit Wer ich bin, das gilt nichts mehr Es zählt nur, wen ich kenn' Wer welche Hand gewaschen hat Manus manum lavat Ein Händedruck Ein stummes Wort Besiegelt euren Pakt Verdammt in alle Ewigkeit Manus manum lavat Ich beiße lustvoll in die Hand Die mir das Futter reicht Fahr' zornig aus der Haut Vor Ungerechtigkeit Wer ich bin, das gilt nichts mehr Es zählt nur, wen ich kenn' Wer welche Hand gewaschen hat Manus manum lavat",1XWvxblOJXf8FnfZqIQr0I,Wer Wind sät,2009-01-01,53CmFroG6MWR5reOOXJX6B,pop,electropop,de,"Manus Manum Lavat-Saltatio Mortis-Getrieben von Gedanken Die ein and'rer für mich denkt Bau' ich mir einen Galgen An dem ein and'rer für mich hängt Ich leb' an dünnen Drähten Die ein and'rer für mich zieht Doch ich bin eine Puppe Vor der ein Puppenspieler flieht Du lebst für deine Kriege Weil ein and'rer für dich stirbt Erstrahlst in hellem Glanze Indem ein and'rer für dich wirbt Wasch deine Hand in Unschuld Die ein and'rer dir poliert Doch meine Hand bleibt sauber Weil niemand sie mir schmiert Ich beiße lustvoll in die Hand Die mir das Futter reicht Fahr' zornig aus der Haut Vor Ungerechtigkeit Wer ich bin, das gilt nichts mehr Es zählt nur, wen ich kenn' Wer welche Hand gewaschen hat Manus manum lavat Auch meine Hand wird schuldig Schreibt sie euch dieses Lied Mein Finger zeigt ins Dunkel Und auf das, was dort geschieht Auf Lüge und Intrige Korruption und Kungelei Auf die gewasch'nen Hände Doch unsere sind nicht dabei Ich beiße lustvoll in die Hand Die mir das Futter reicht Fahr' zornig aus der Haut Vor Ungerechtigkeit Wer ich bin, das gilt nichts mehr Es zählt nur, wen ich kenn' Wer welche Hand gewaschen hat Manus manum lavat Ein Händedruck Ein stummes Wort Besiegelt euren Pakt Verdammt in alle Ewigkeit Manus manum lavat Ich beiße lustvoll in die Hand Die mir das Futter reicht Fahr' zornig aus der Haut Vor Ungerechtigkeit Wer ich bin, das gilt nichts mehr Es zählt nur, wen ich kenn' Wer welche Hand gewaschen hat Manus manum lavat-pop-electropop"
0qTw7kEFpNdECY7jRCg54v,Million Voices,Otto Knows,(Verse 1) Eh Eh Eh Eh Eh Ow Ow Ow Ow Ow Ah Ah Ah Ah Ah Ah Ah Ah Ah Ah Ah Eh Eh Eh Eh Eh Ow Ow Ow Ow Ow Ah Ah Ah Ah Ah Ah Ah Ah Ah Ah Ah Eh Eh Eh Eh Eh Ow Ow Ow Ow Ow Ah Ah Ah Ah Ah Ah Ah Ah Ah Ah Ah Eh Eh Eh Eh Eh Ow Ow Ow Ow Ow Ah Ah Ah Ah Ah Ah Ah Ah Ah Ah Ah Eh Eh Eh Eh Eh Ow Ow Ow Ow Ow Ah Ah Ah Ah Ah Ah Ah Ah Ah Ah Ah Eh Eh Eh Eh Eh Ow Ow Ow Ow Ow Ah Ah Ah Ah Ah Ah Ah Ah Ah Ah Ah Eh Eh Eh Eh Eh Ow Ow Ow Ow Ow Ah Ah Ah Ah Ah Ah Ah Ah Ah Ah Ah Eh Eh Eh Eh Eh Ow Ow Ow Ow Ow Ah Ah Ah Ah Ah Ah Ah Ah Ah Ah Ah Eh Eh Eh Eh Eh Ow Ow Ow Ow Ow Ah Ah Ah Ah Ah Ah Ah Ah Ah Ah Ah Eh Eh Eh Eh Eh Ow Ow Ow Ow Ow Ah Ah Ah Ah Ah Ah Ah Ah Ah Ah Ah (Instrumental) (Verse 1) Eh Eh Eh Eh Eh Ow Ow Ow Ow Ow Ah Ah Ah Ah Ah Ah Ah Ah Ah Ah Ah Eh Eh Eh Eh Eh Ow Ow Ow Ow Ow Ah Ah Ah Ah Ah Ah Ah Ah Ah Ah Ah Eh Eh Eh Eh Eh Ow Ow Ow Ow Ow Ah Ah Ah Ah Ah Ah Ah Ah Ah Ah Ah Eh Eh Eh Eh Eh Ow Ow Ow Ow Ow Ah Ah Ah Ah Ah Ah Ah Ah Ah Ah Ah Eh Eh Eh Eh Eh Ow Ow Ow Ow Ow Ah Ah Ah Ah Ah Ah Ah Ah Ah Ah Ah Eh Eh Eh Eh Eh Ow Ow Ow Ow Ow Ah Ah Ah Ah Ah Ah Ah Ah Ah Ah Ah Eh Eh Eh Eh Eh Ow Ow Ow Ow Ow Ah Ah Ah Ah Ah Ah Ah Ah Ah Ah Ah Eh Eh Eh Eh Eh Ow Ow Ow Ow Ow Ah Ah Ah Ah Ah Ah Ah Ah Ah Ah Ah Eh Eh Eh Eh Eh Ow Ow Ow Ow Ow Ah Ah Ah Ah Ah Ah Ah Ah Ah Ah Ah Eh Eh Eh Eh Eh Ow Ow Ow Ow Ow Ah Ah Ah Ah Ah Ah Ah Ah Ah Ah Ah,1VTFVZ15TbeNwwTLhpMjAZ,Million Voices,2012-01-01,5BqOZpVEqRDfZScvW1QUyA,edm,progressive electro house,de,Million Voices-Otto Knows-(Verse 1) Eh Eh Eh Eh Eh Ow Ow Ow Ow Ow Ah Ah Ah Ah Ah Ah Ah Ah Ah Ah Ah Eh Eh Eh Eh Eh Ow Ow Ow Ow Ow Ah Ah Ah Ah Ah Ah Ah Ah Ah Ah Ah Eh Eh Eh Eh Eh Ow Ow Ow Ow Ow Ah Ah Ah Ah Ah Ah Ah Ah Ah Ah Ah Eh Eh Eh Eh Eh Ow Ow Ow Ow Ow Ah Ah Ah Ah Ah Ah Ah Ah Ah Ah Ah Eh Eh Eh Eh Eh Ow Ow Ow Ow Ow Ah Ah Ah Ah Ah Ah Ah Ah Ah Ah Ah Eh Eh Eh Eh Eh Ow Ow Ow Ow Ow Ah Ah Ah Ah Ah Ah Ah Ah Ah Ah Ah Eh Eh Eh Eh Eh Ow Ow Ow Ow Ow Ah Ah Ah Ah Ah Ah Ah Ah Ah Ah Ah Eh Eh Eh Eh Eh Ow Ow Ow Ow Ow Ah Ah Ah Ah Ah Ah Ah Ah Ah Ah Ah Eh Eh Eh Eh Eh Ow Ow Ow Ow Ow Ah Ah Ah Ah Ah Ah Ah Ah Ah Ah Ah Eh Eh Eh Eh Eh Ow Ow Ow Ow Ow Ah Ah Ah Ah Ah Ah Ah Ah Ah Ah Ah (Instrumental) (Verse 1) Eh Eh Eh Eh Eh Ow Ow Ow Ow Ow Ah Ah Ah Ah Ah Ah Ah Ah Ah Ah Ah Eh Eh Eh Eh Eh Ow Ow Ow Ow Ow Ah Ah Ah Ah Ah Ah Ah Ah Ah Ah Ah Eh Eh Eh Eh Eh Ow Ow Ow Ow Ow Ah Ah Ah Ah Ah Ah Ah Ah Ah Ah Ah Eh Eh Eh Eh Eh Ow Ow Ow Ow Ow Ah Ah Ah Ah Ah Ah Ah Ah Ah Ah Ah Eh Eh Eh Eh Eh Ow Ow Ow Ow Ow Ah Ah Ah Ah Ah Ah Ah Ah Ah Ah Ah Eh Eh Eh Eh Eh Ow Ow Ow Ow Ow Ah Ah Ah Ah Ah Ah Ah Ah Ah Ah Ah Eh Eh Eh Eh Eh Ow Ow Ow Ow Ow Ah Ah Ah Ah Ah Ah Ah Ah Ah Ah Ah Eh Eh Eh Eh Eh Ow Ow Ow Ow Ow Ah Ah Ah Ah Ah Ah Ah Ah Ah Ah Ah Eh Eh Eh Eh Eh Ow Ow Ow Ow Ow Ah Ah Ah Ah Ah Ah Ah Ah Ah Ah Ah Eh Eh Eh Eh Eh Ow Ow Ow Ow Ow Ah Ah Ah Ah Ah Ah Ah Ah Ah Ah Ah-edm-progressive electro house
