track_id,track_name,track_artist,lyrics,track_album_id,track_album_name,track_album_release_date,playlist_id,playlist_genre,playlist_subgenre,language,concatenated
1iSctFzf915OKMmqu6M65o,Treppenhaus Authentic,Olexesh,"OL, der Rest geht zur Seite Punch den Beat, Super Skunk, ich petz' nur das Feinste Das soll heißen, Olexesh schießt mit harte Eisen Geier kreisen, Drago-Stil, Mike Tyson, Ohr abbeißen Mach's alleine, 385 ideale Reime Der Automat blockt und nimmt sich meine Scheine Manche sagen, Hurensohn, warum verkaufst du die Goldkette Von deiner Mutter du Nuttensohn? Nicht in diesem Ton, wer hat dir das beigebracht? Jungs ausm Hinterhof, wo man nachts am Fenster klopft Vorbild war hoch, Mister Hugh, Sefyu Molotov Westcoast, Dr. Dre, B.I.G., Nate Dogg Moscow Unterwelt, welcome in the rich world Treffpunkt Oase, Politiker mit zwanzig Girls So wie sich's gehört, 385 in der Überzahl Komm frontal, dieses Jahr peitsch' ich auf jeden Fall Boxerschnitt, Ustra, Verfolgungsjagd, U-BahnMenace II Society rennt gegen die Uhrzeit Schnell weg, sonst schnappt er dich, was für 'ne zweite Chance? Wer nicht will, der hat schon, Bunkern ist keine Kunst Boxerschnitt, Ustra, Verfolgungsjagd, U-Bahn Menace II Society rennt gegen die Uhrzeit Lauf' durch das Treppenhaus, irgendwas ist seltsam Merkt man, wenn man in den Taschen kein'n Cent hat Der Slave ist frisch drin wie ein Häftling Heftig, Nu Eta Da bombt mit Technik Schewtschenko, Hattrick, Fallrückzieher, Dropkick Einzelgänger, Actionstar, Mittel gegen Dorfkids Es gibt Tage, da hab' ich mal kein Geld, und Es gibt Tage, da zieh' ich um die Welt, hey Was du davon hältst, juckt hier keine Sau Mach hier nicht auf Thuglife, jeder fickt mit deiner Frau Soll ich oder nicht, oder mitten ins Gesicht Bra, entscheid dich, denn hier ist kein Platz, ich brauch' Licht Ganz egal, wie du tickst, du bist zu abgewichst Irgenwann kommt der Tag, wo du ans falsche Haus pisst Oben ist der, wo sitzt, und nur ganz selten schwitzt Mit 200er in Hand, gelbe Scheine sind krank Doch ich mag den Gestank, das ist meine Welt Velli sagt, ab jetzt wird richtig gemelkt Boxerschnitt, Ustra, Verfolgungsjagd, U-BahnMenace II Society rennt gegen die Uhrzeit Schnell weg, sonst schnappt er dich, was für 'ne zweite Chance? Wer nicht will, der hat schon, Bunkern ist keine Kunst Boxerschnitt, Ustra, Verfolgungsjagd, U-Bahn Menace II Society rennt gegen die Uhrzeit Lauf' durch das Treppenhaus, irgendwas ist seltsam Merkt man, wenn man in den Taschen kein'n Cent hat",1ck1hyJmy7EfgoiOJouFMP,Nu Eta Da,2014-03-07,5GA8GDo7RQC3JEanT81B3g,rap,gangster rap,de,"Treppenhaus Authentic-Olexesh-OL, der Rest geht zur Seite Punch den Beat, Super Skunk, ich petz' nur das Feinste Das soll heißen, Olexesh schießt mit harte Eisen Geier kreisen, Drago-Stil, Mike Tyson, Ohr abbeißen Mach's alleine, 385 ideale Reime Der Automat blockt und nimmt sich meine Scheine Manche sagen, Hurensohn, warum verkaufst du die Goldkette Von deiner Mutter du Nuttensohn? Nicht in diesem Ton, wer hat dir das beigebracht? Jungs ausm Hinterhof, wo man nachts am Fenster klopft Vorbild war hoch, Mister Hugh, Sefyu Molotov Westcoast, Dr. Dre, B.I.G., Nate Dogg Moscow Unterwelt, welcome in the rich world Treffpunkt Oase, Politiker mit zwanzig Girls So wie sich's gehört, 385 in der Überzahl Komm frontal, dieses Jahr peitsch' ich auf jeden Fall Boxerschnitt, Ustra, Verfolgungsjagd, U-BahnMenace II Society rennt gegen die Uhrzeit Schnell weg, sonst schnappt er dich, was für 'ne zweite Chance? Wer nicht will, der hat schon, Bunkern ist keine Kunst Boxerschnitt, Ustra, Verfolgungsjagd, U-Bahn Menace II Society rennt gegen die Uhrzeit Lauf' durch das Treppenhaus, irgendwas ist seltsam Merkt man, wenn man in den Taschen kein'n Cent hat Der Slave ist frisch drin wie ein Häftling Heftig, Nu Eta Da bombt mit Technik Schewtschenko, Hattrick, Fallrückzieher, Dropkick Einzelgänger, Actionstar, Mittel gegen Dorfkids Es gibt Tage, da hab' ich mal kein Geld, und Es gibt Tage, da zieh' ich um die Welt, hey Was du davon hältst, juckt hier keine Sau Mach hier nicht auf Thuglife, jeder fickt mit deiner Frau Soll ich oder nicht, oder mitten ins Gesicht Bra, entscheid dich, denn hier ist kein Platz, ich brauch' Licht Ganz egal, wie du tickst, du bist zu abgewichst Irgenwann kommt der Tag, wo du ans falsche Haus pisst Oben ist der, wo sitzt, und nur ganz selten schwitzt Mit 200er in Hand, gelbe Scheine sind krank Doch ich mag den Gestank, das ist meine Welt Velli sagt, ab jetzt wird richtig gemelkt Boxerschnitt, Ustra, Verfolgungsjagd, U-BahnMenace II Society rennt gegen die Uhrzeit Schnell weg, sonst schnappt er dich, was für 'ne zweite Chance? Wer nicht will, der hat schon, Bunkern ist keine Kunst Boxerschnitt, Ustra, Verfolgungsjagd, U-Bahn Menace II Society rennt gegen die Uhrzeit Lauf' durch das Treppenhaus, irgendwas ist seltsam Merkt man, wenn man in den Taschen kein'n Cent hat-rap-gangster rap"
1j9Ps8QdrngyB0RzFK1Qwc,Wahre Begebenheiten (feat. AK Ausserkontrolle),18 Karat,"Ich komm' mit Kickdown im goldenen Lamborghini Huracan Mama lebt mit der Angst, dass ich mir 'ne Kugel fang' Im Benz rumheizende, grenzübergreifende Gangs, die zu hundert Prozent über Leichen geh'n Yeah, guck, wie dir die Straße das Leben zeigt Das alles hier basiert auf wahrer Begebenheit Ich sitz' mit Unterweltgrößen am Tisch Ich geb' grünes Licht und dann töten sie dich Kein Film, alles echt, Vato, skrupellos und kein Gewissen Brüder sind für mich bereit zu schießen und bereit zu sitzen Also was labert ihr von Gangstarapper? Guckt, wie ich wöchentlich mit Kilos durch die Grenzen bretter' Hundert-Mille-Schmuck tragen, Batzen in den Schubladen Mit dreißig Mann auf meine Kosten in den Club fahren Pushware, die mich für zig Jahre einsperrt Doch das ist mir dieser Scheiß wert, yeah Fick Beef! Ich schlag' dir die Zähne ein Flieh! Denn das beruht auf wahren Begebenheiten Ich fick' den Markt und ich bunker' 'ne Tonne 18 Karat - alles unter Kontrolle (ahu) Fick Beef! Ich schlag' dir die Zähne ein Flieh! Denn das beruht auf wahren Begebenheiten Ich fick' den Markt und ich bunker' 'ne Tonne Ausserkontrolle - alles unter Kontrolle (ahu) Ich komm' im AMG CLS Benz mit Tieren Dreihundert-Gramm-Kette - Cash, zehn Riesen Giftige Blitzdiebe, alles in'n Kauf nehm'n Tipps kriegen, ausspähen, Vitrinen ausleeren Der Staat sagt, dass unsre Taten verheerend sei'n Denn das beruht auf wahren Begebenheiten Plan in die Wege leiten, Vectra muss her Kinoreife Vorstellung - spektakulär Schurken aus der kranken Welt Die Gas geben, aufs Pedal treten, bis der Motor auseinanderfällt Wir bring'n dich um mit der Trommel Dum-Dum-Geschosse, Zeugen stumm, wenn wir kommen Alles unter Kontrolle Aus den Taschen kommen 500er-RollenIch trage achtzehn Karat Gold Und wünsch' mei'm Bruder 18 Karat Gold Fick Beef! Ich schlag' dir die Zähne ein Flieh! Denn das beruht auf wahren Begebenheiten Ich fick' den Markt und ich bunker' 'ne Tonne 18 Karat - alles unter Kontrolle (ahu) Fick Beef! Ich schlag' dir die Zähne ein Flieh! Denn das beruht auf wahren Begebenheiten Ich fick' den Markt und ich bunker' 'ne Tonne Ausserkontrolle - alles unter Kontrolle (ahu)",3y1eDeljkPnVtSUVMMU265,PUSHA,2017-04-07,5GA8GDo7RQC3JEanT81B3g,rap,gangster rap,de,"Wahre Begebenheiten (feat. AK Ausserkontrolle)-18 Karat-Ich komm' mit Kickdown im goldenen Lamborghini Huracan Mama lebt mit der Angst, dass ich mir 'ne Kugel fang' Im Benz rumheizende, grenzübergreifende Gangs, die zu hundert Prozent über Leichen geh'n Yeah, guck, wie dir die Straße das Leben zeigt Das alles hier basiert auf wahrer Begebenheit Ich sitz' mit Unterweltgrößen am Tisch Ich geb' grünes Licht und dann töten sie dich Kein Film, alles echt, Vato, skrupellos und kein Gewissen Brüder sind für mich bereit zu schießen und bereit zu sitzen Also was labert ihr von Gangstarapper? Guckt, wie ich wöchentlich mit Kilos durch die Grenzen bretter' Hundert-Mille-Schmuck tragen, Batzen in den Schubladen Mit dreißig Mann auf meine Kosten in den Club fahren Pushware, die mich für zig Jahre einsperrt Doch das ist mir dieser Scheiß wert, yeah Fick Beef! Ich schlag' dir die Zähne ein Flieh! Denn das beruht auf wahren Begebenheiten Ich fick' den Markt und ich bunker' 'ne Tonne 18 Karat - alles unter Kontrolle (ahu) Fick Beef! Ich schlag' dir die Zähne ein Flieh! Denn das beruht auf wahren Begebenheiten Ich fick' den Markt und ich bunker' 'ne Tonne Ausserkontrolle - alles unter Kontrolle (ahu) Ich komm' im AMG CLS Benz mit Tieren Dreihundert-Gramm-Kette - Cash, zehn Riesen Giftige Blitzdiebe, alles in'n Kauf nehm'n Tipps kriegen, ausspähen, Vitrinen ausleeren Der Staat sagt, dass unsre Taten verheerend sei'n Denn das beruht auf wahren Begebenheiten Plan in die Wege leiten, Vectra muss her Kinoreife Vorstellung - spektakulär Schurken aus der kranken Welt Die Gas geben, aufs Pedal treten, bis der Motor auseinanderfällt Wir bring'n dich um mit der Trommel Dum-Dum-Geschosse, Zeugen stumm, wenn wir kommen Alles unter Kontrolle Aus den Taschen kommen 500er-RollenIch trage achtzehn Karat Gold Und wünsch' mei'm Bruder 18 Karat Gold Fick Beef! Ich schlag' dir die Zähne ein Flieh! Denn das beruht auf wahren Begebenheiten Ich fick' den Markt und ich bunker' 'ne Tonne 18 Karat - alles unter Kontrolle (ahu) Fick Beef! Ich schlag' dir die Zähne ein Flieh! Denn das beruht auf wahren Begebenheiten Ich fick' den Markt und ich bunker' 'ne Tonne Ausserkontrolle - alles unter Kontrolle (ahu)-rap-gangster rap"
1jaVHAdoEONRCrcNvRtCFY,Vorankommen,Luciano,"Yeah, yeah Yeah, wir müssen vorankomm'n, yeah Vorankomm'n (vorankomm'n) Vorankomm'n, Augen nur auf dicke Bündel Bruder, muss vorankomm'n (vorankomm'n) Vorankomm'n (ey, ey, ey) Vorankomm'n (yeah, vorankomm'n) Vorankomm'n, Augen nur auf dicke Bündel Bruder, muss vorankomm'n (vorankomm'n) Vorankomm'n (ey, ey, ey), vorankomm'n Negro, ich muss vorankomm'n Schreibe weiter Bretter, denn die Scheiße muss konstant komm'n Ankomm'n, muss an die dicken Bündel rankomm'n Der Frieden meiner Seele muss auch irgendwann komm'n Wenig Schlaf, häufig nachts bleib' ich wach Bis ich Papa bald sag', „Alles gut, ich bin ein Star!“ (yeah) Auf und ab, doch geb' Gas für Mula Werd' nicht satt, komm' voran, bald Benzer, wunderbar (vorankomm'n) Kafa lesh Ein paar Jackie-Gläser eisgekühlt und die Nächte sind perfekt (Yeah, kafa lesh, yeah) (Ein paar Jackie-Gläser eisgekühlt und die Nächte sind perfekt) Damals sinnlos am Block rumgesplifft Heute komm' ich voran, Universal-Unterschrift (yeah) Bleib' loyal, meine Gang, sie kommt mit Gib mir ein Blatt und ein'n Stift, Mama, bald bin ich rich Vorankomm'n Vorankomm'n, Augen nur auf dicke Bündel Bruder, muss vorankomm'n Vorankomm'n (yeah), vorankomm'n Vorankomm'n, Augen nur auf dicke Bündel Bruder, muss vorankomm'n Vorankomm'n (yeah), vorankomm'n Voll mit Hass, trotzdem Person im Herz Glaub mir, viel ist es wert, es läuft vieles verkehrt Jeden Tag wird es leicht, wird es schwer Doch ich weiß viel zu sehr, dass ich niemals umkehr' Vorankomm'n bleibt der Punkt, bleibt das Ziel Mal im Sumpf, mal im Meer, doch ich bleib' dran, mon frère Irgendwie tut die ganze Scheiße weh Doch muss meine Wege geh'n Denn ich muss gucken, wo ich steh'Es wird eng, wenn der Sheytan dir nah steht Dein Kopf spielt verrückt und dein Inneres in Rage Doch bleib dran und dann findest du die Waage Hör niemals auf, hol die Antwort auf die Frage Ich muss vorankomm'n, meine Wege gehen, Bruder Denn ich muss vorankomm'n (yeah, yeah) Ich muss vorankomm'n (yeah, yeah) Ich muss vorankomm'n (vorankomm'n) Vorankomm'n, Augen nur auf dicke Bündel Bruder, muss vorankomm'n (vorankomm'n) Vorankomm'n (ey, ey, ey) Vorankomm'n (yeah, vorankomm'n) Vorankomm'n, Augen nur auf dicke Bündel Bruder, muss vorankomm'n (vorankomm'n) Vorankomm'n (ey, ey, ey) Vorankomm'n— Vorankomm'n, Augen nur auf dicke Bündel Bruder, muss vorankomm'n (vorankomm'n) Vorankomm'n (ey, ey, ey) Vorankomm'n (yeah, vorankomm'n) Vorankomm'n, Augen nur auf dicke Bündel Bruder, muss vorankomm'n (vorankomm'n) Vorankomm'n (ey, ey, ey) Vorankomm'n (yeah) Flex",4ADIqpPBchOMHfHYRL9HU1,Eiskalt,2017-11-17,5GA8GDo7RQC3JEanT81B3g,rap,gangster rap,de,"Vorankommen-Luciano-Yeah, yeah Yeah, wir müssen vorankomm'n, yeah Vorankomm'n (vorankomm'n) Vorankomm'n, Augen nur auf dicke Bündel Bruder, muss vorankomm'n (vorankomm'n) Vorankomm'n (ey, ey, ey) Vorankomm'n (yeah, vorankomm'n) Vorankomm'n, Augen nur auf dicke Bündel Bruder, muss vorankomm'n (vorankomm'n) Vorankomm'n (ey, ey, ey), vorankomm'n Negro, ich muss vorankomm'n Schreibe weiter Bretter, denn die Scheiße muss konstant komm'n Ankomm'n, muss an die dicken Bündel rankomm'n Der Frieden meiner Seele muss auch irgendwann komm'n Wenig Schlaf, häufig nachts bleib' ich wach Bis ich Papa bald sag', „Alles gut, ich bin ein Star!“ (yeah) Auf und ab, doch geb' Gas für Mula Werd' nicht satt, komm' voran, bald Benzer, wunderbar (vorankomm'n) Kafa lesh Ein paar Jackie-Gläser eisgekühlt und die Nächte sind perfekt (Yeah, kafa lesh, yeah) (Ein paar Jackie-Gläser eisgekühlt und die Nächte sind perfekt) Damals sinnlos am Block rumgesplifft Heute komm' ich voran, Universal-Unterschrift (yeah) Bleib' loyal, meine Gang, sie kommt mit Gib mir ein Blatt und ein'n Stift, Mama, bald bin ich rich Vorankomm'n Vorankomm'n, Augen nur auf dicke Bündel Bruder, muss vorankomm'n Vorankomm'n (yeah), vorankomm'n Vorankomm'n, Augen nur auf dicke Bündel Bruder, muss vorankomm'n Vorankomm'n (yeah), vorankomm'n Voll mit Hass, trotzdem Person im Herz Glaub mir, viel ist es wert, es läuft vieles verkehrt Jeden Tag wird es leicht, wird es schwer Doch ich weiß viel zu sehr, dass ich niemals umkehr' Vorankomm'n bleibt der Punkt, bleibt das Ziel Mal im Sumpf, mal im Meer, doch ich bleib' dran, mon frère Irgendwie tut die ganze Scheiße weh Doch muss meine Wege geh'n Denn ich muss gucken, wo ich steh'Es wird eng, wenn der Sheytan dir nah steht Dein Kopf spielt verrückt und dein Inneres in Rage Doch bleib dran und dann findest du die Waage Hör niemals auf, hol die Antwort auf die Frage Ich muss vorankomm'n, meine Wege gehen, Bruder Denn ich muss vorankomm'n (yeah, yeah) Ich muss vorankomm'n (yeah, yeah) Ich muss vorankomm'n (vorankomm'n) Vorankomm'n, Augen nur auf dicke Bündel Bruder, muss vorankomm'n (vorankomm'n) Vorankomm'n (ey, ey, ey) Vorankomm'n (yeah, vorankomm'n) Vorankomm'n, Augen nur auf dicke Bündel Bruder, muss vorankomm'n (vorankomm'n) Vorankomm'n (ey, ey, ey) Vorankomm'n— Vorankomm'n, Augen nur auf dicke Bündel Bruder, muss vorankomm'n (vorankomm'n) Vorankomm'n (ey, ey, ey) Vorankomm'n (yeah, vorankomm'n) Vorankomm'n, Augen nur auf dicke Bündel Bruder, muss vorankomm'n (vorankomm'n) Vorankomm'n (ey, ey, ey) Vorankomm'n (yeah) Flex-rap-gangster rap"
1JEme3LPa3PqqVqshasC40,In der Hood,Azad,"Digga, kipp' den Voddi in die Reddie-Dose Hänge mit den Jungs vor dem Block Trage die Neunmilli in der Baggyhose Gebe Mittelfinger an die Cops Vierer-Kurs geht, kein Ding Augen aufhalten, überall ist Kripo31er sind am sing'n Helikopter fliegen über unsern Dächern Jagen und sie geben nie auf Immer auf der Suche nach den Schwerverbrechern Scheißen drauf und nehmen's in Kauf Bündel in den Socken, die Geschäfte laufen Jeder will die Patte heimbring'n Küchen sind am Kochen, weil die Crackies rauchen Isso, da wo wir daheim sind Isso in der Hood, in der Hood, in der Hood Isso in der Hood, in der Hood, in der Hood Isso in der Hood, in der Hood, in der Hood Isso in der Hood, in der Hood, in der Hood Dicke Königsketten über Trainingsjacken Laufen durch die Gegend mit 'nem Pit' Bullen auf der Lauer, wollen Täter packen Chaba, dieses Leben ist 'ne Bitch Geben Fick auf alles, fühlen so wie Tony Isso, diese Welt gehört uns Immer auf der Jagd, jeder will das Lobi Bin auf Streifzug mit den Jungs Nordi-Style, Digga, das ist wie wir leben N-O-R-D-W-E-S-T Dis is' wie es abläuft in dieser Gegend N-O-R-D-W-E-S-T Isso in der Hood, in der Hood, in der Hood Isso in der Hood, in der Hood, in der Hood Isso in der Hood, in der Hood, in der Hood Isso in der Hood, in der Hood, in der Hood Güteklasse A, Platten sind aus Nador Bei uns läuft nicht, bei uns fliegt Killer-Haze, Twis, Chaba oder Naco Die Digi reicht nicht, wenn man wiegt Projektile fliegen, manchmal wird es bitter Die Wurzel alles Bösen ist Geld Brüder gehen rein, sitzen hinter Gitter Kleine Brüder übernehmen schnell Isso in der Hood, in der Hood, in der Hood Isso in der Hood, in der Hood, in der Hood Isso in der Hood, in der Hood, in der Hood Isso in der Hood, in der Hood, in der Hood",0L1cWdU9cxuKLLQxnSPWxE,NXTLVL,2017-07-21,1qXg9ck25tBRxeXsj8mbDG,rap,gangster rap,de,"In der Hood-Azad-Digga, kipp' den Voddi in die Reddie-Dose Hänge mit den Jungs vor dem Block Trage die Neunmilli in der Baggyhose Gebe Mittelfinger an die Cops Vierer-Kurs geht, kein Ding Augen aufhalten, überall ist Kripo31er sind am sing'n Helikopter fliegen über unsern Dächern Jagen und sie geben nie auf Immer auf der Suche nach den Schwerverbrechern Scheißen drauf und nehmen's in Kauf Bündel in den Socken, die Geschäfte laufen Jeder will die Patte heimbring'n Küchen sind am Kochen, weil die Crackies rauchen Isso, da wo wir daheim sind Isso in der Hood, in der Hood, in der Hood Isso in der Hood, in der Hood, in der Hood Isso in der Hood, in der Hood, in der Hood Isso in der Hood, in der Hood, in der Hood Dicke Königsketten über Trainingsjacken Laufen durch die Gegend mit 'nem Pit' Bullen auf der Lauer, wollen Täter packen Chaba, dieses Leben ist 'ne Bitch Geben Fick auf alles, fühlen so wie Tony Isso, diese Welt gehört uns Immer auf der Jagd, jeder will das Lobi Bin auf Streifzug mit den Jungs Nordi-Style, Digga, das ist wie wir leben N-O-R-D-W-E-S-T Dis is' wie es abläuft in dieser Gegend N-O-R-D-W-E-S-T Isso in der Hood, in der Hood, in der Hood Isso in der Hood, in der Hood, in der Hood Isso in der Hood, in der Hood, in der Hood Isso in der Hood, in der Hood, in der Hood Güteklasse A, Platten sind aus Nador Bei uns läuft nicht, bei uns fliegt Killer-Haze, Twis, Chaba oder Naco Die Digi reicht nicht, wenn man wiegt Projektile fliegen, manchmal wird es bitter Die Wurzel alles Bösen ist Geld Brüder gehen rein, sitzen hinter Gitter Kleine Brüder übernehmen schnell Isso in der Hood, in der Hood, in der Hood Isso in der Hood, in der Hood, in der Hood Isso in der Hood, in der Hood, in der Hood Isso in der Hood, in der Hood, in der Hood-rap-gangster rap"
1kAsrCFSZvPfhQKwkXTNOV,Fake Love,Olexesh,"Sie shakt up für die Mill'n, shake up Verdammt, sie macht es sehr gut Sie lächelt, wenn sie strippt, Fake-Love Sie hustlet an der Stange, geh weg, ho, ho, ho Wir tanzen aufm Mond, Paper Sie putzt meine Felgen im Rotlicht Sie lächelt, wenn sie strippt, Fake-Love Verdammt, sie macht es gut, Baby Sie fuckt ab, tanzt vor der Haube, drückt Bucks ab Sie shakt jede Nacht auf Papp für die Kids im BlockRea-Ready or not here, here I come, come Sie geht eine Nummer noch tiefer, grind auf Stang'nSchick mit ihr'm Kiefer, echte Liebe spürte sie niemals Leben zu deep, ah, deep, ah Shake für die Rims, shake für die Mill'n Skake für die Grillz, break, break tiefer, tiefer Shake, wie du willst, shake zu 'nem wilden „Hey!“Pray für die Bitch, pray für die Bitch, pray Down, wenn sie geht, down, wenn sie geht, hey Break zu dem Beat, break zu dem Beat, Babe Fake, wenn sie lacht, fake, wenn sie sagt, „Hey!“ Strip ist ihr way, Strip ist ihr way, Babe Day-D-D-Day-Day-D-D-Day-Date Tanz für den Fame, tanz für den Fame, shake Werf' mit dem Geld, werf' mit Geld, ey Dreh um die Welt, dreh um die Welt, fake Sie fuckt ab, wechselt immer den Partner Bitch, park ab, gib ab da Wippt immer wieder zur Pac Rea-ready or not, here, here I come, come Beweg dein'n Arsch für die OGs Wipp für die Roli, tanz mit den Homies Laubi, hängst an Seiten wie Mogli, Mogli Strip, strip, sie macht Windmühle, bra Thomas grätscht ihr hinterher, der da hinter dir sagt „Komm und verwirr mich am Flipper Tanz für mein'n Bruder, schieb mir kein Film, Mann!“ Sie shakt up für die Mill'n, shake up Verdammt, sie macht es sehr gut Sie lächelt, wenn sie strippt, Fake-Love Sie hustlet an der Stange, geh weg, ho, ho, ho Wir tanzen aufm Mond, Paper Sie putzt meine Felgen im Rotlicht Sie lächelt, wenn sie strippt, Fake-Love Verdammt, sie macht es gut, Baby Ja, sie strippt für mich jede Nacht, ja, ja, ja Baby, komm, bitte mach dich nackt, ja, ja, ja Kein Problem, Babe, lass die Neider reden Ich lass' Scheine regnen Und sie sagt, „Ufo, bitte bleib, bleib, bleib hier!“, ja, ja, ja Ja, vergessen, wie sie heißt, Dicka, weil ich ein Kiffer bin, ja Weil sie so lebt, ja, ja, sie bleibt 'ne Stripperin, ja Sie ist nicer, scheiß auf Amber Rose, ja Dicka, Dicka, private Show, ja Wo das Geld ist, sind die Hoes, ja Dicker Arsch, dicke Titten Bestell' 'ne Flasche, lass' sie strippen Hab' mich wegen ihr gestern Nacht mit Tiffany hart gestritten Ja, sie ist 'ne Stripperin, ja Sie macht es für ihre Familie, ja Nicht für die Liebe Keine Gefühle, ja, ja Sie shakt up für die Mill'n, shake up Verdammt, sie macht es sehr gut Sie lächelt, wenn sie strippt, Fake-Love Sie hustlet an der Stange, geh weg, ho, ho, ho Wir tanzen aufm Mond, Paper Sie putzt meine Felgen im Rotlicht Sie lächelt, wenn sie strippt, Fake-Love Verdammt, sie macht es gut, Baby",3whvTAIClofWdLa8PviZjc,ROLEXESH,2018-03-02,5GA8GDo7RQC3JEanT81B3g,rap,gangster rap,de,"Fake Love-Olexesh-Sie shakt up für die Mill'n, shake up Verdammt, sie macht es sehr gut Sie lächelt, wenn sie strippt, Fake-Love Sie hustlet an der Stange, geh weg, ho, ho, ho Wir tanzen aufm Mond, Paper Sie putzt meine Felgen im Rotlicht Sie lächelt, wenn sie strippt, Fake-Love Verdammt, sie macht es gut, Baby Sie fuckt ab, tanzt vor der Haube, drückt Bucks ab Sie shakt jede Nacht auf Papp für die Kids im BlockRea-Ready or not here, here I come, come Sie geht eine Nummer noch tiefer, grind auf Stang'nSchick mit ihr'm Kiefer, echte Liebe spürte sie niemals Leben zu deep, ah, deep, ah Shake für die Rims, shake für die Mill'n Skake für die Grillz, break, break tiefer, tiefer Shake, wie du willst, shake zu 'nem wilden „Hey!“Pray für die Bitch, pray für die Bitch, pray Down, wenn sie geht, down, wenn sie geht, hey Break zu dem Beat, break zu dem Beat, Babe Fake, wenn sie lacht, fake, wenn sie sagt, „Hey!“ Strip ist ihr way, Strip ist ihr way, Babe Day-D-D-Day-Day-D-D-Day-Date Tanz für den Fame, tanz für den Fame, shake Werf' mit dem Geld, werf' mit Geld, ey Dreh um die Welt, dreh um die Welt, fake Sie fuckt ab, wechselt immer den Partner Bitch, park ab, gib ab da Wippt immer wieder zur Pac Rea-ready or not, here, here I come, come Beweg dein'n Arsch für die OGs Wipp für die Roli, tanz mit den Homies Laubi, hängst an Seiten wie Mogli, Mogli Strip, strip, sie macht Windmühle, bra Thomas grätscht ihr hinterher, der da hinter dir sagt „Komm und verwirr mich am Flipper Tanz für mein'n Bruder, schieb mir kein Film, Mann!“ Sie shakt up für die Mill'n, shake up Verdammt, sie macht es sehr gut Sie lächelt, wenn sie strippt, Fake-Love Sie hustlet an der Stange, geh weg, ho, ho, ho Wir tanzen aufm Mond, Paper Sie putzt meine Felgen im Rotlicht Sie lächelt, wenn sie strippt, Fake-Love Verdammt, sie macht es gut, Baby Ja, sie strippt für mich jede Nacht, ja, ja, ja Baby, komm, bitte mach dich nackt, ja, ja, ja Kein Problem, Babe, lass die Neider reden Ich lass' Scheine regnen Und sie sagt, „Ufo, bitte bleib, bleib, bleib hier!“, ja, ja, ja Ja, vergessen, wie sie heißt, Dicka, weil ich ein Kiffer bin, ja Weil sie so lebt, ja, ja, sie bleibt 'ne Stripperin, ja Sie ist nicer, scheiß auf Amber Rose, ja Dicka, Dicka, private Show, ja Wo das Geld ist, sind die Hoes, ja Dicker Arsch, dicke Titten Bestell' 'ne Flasche, lass' sie strippen Hab' mich wegen ihr gestern Nacht mit Tiffany hart gestritten Ja, sie ist 'ne Stripperin, ja Sie macht es für ihre Familie, ja Nicht für die Liebe Keine Gefühle, ja, ja Sie shakt up für die Mill'n, shake up Verdammt, sie macht es sehr gut Sie lächelt, wenn sie strippt, Fake-Love Sie hustlet an der Stange, geh weg, ho, ho, ho Wir tanzen aufm Mond, Paper Sie putzt meine Felgen im Rotlicht Sie lächelt, wenn sie strippt, Fake-Love Verdammt, sie macht es gut, Baby-rap-gangster rap"
