track_id,track_name,track_artist,lyrics,track_album_id,track_album_name,track_album_release_date,playlist_id,playlist_genre,playlist_subgenre,language,concatenated
137VK6DhNh2f6qhx1CaQ4g,Umsatzfixiert,Capital Bra,"Renn Wir sind Berliner, unsre Gegend ist ein bisschen krasser Schmeiß uns in 'ne Wüste und wir finden Wasser Wer von euch ist Baba? Ach, mach mal kein Palaver Ich fress' die Ratten auf wie 'ne Mamba Bratan, ja, Kolleg, ich sorg' für Wirbel Der Bratan will die Bündel, Makarow im Guccigürtel Erzähl mir nix von dir und deinem krassen Viertel Komm'n wir in dein Cafe, dann fliegt ihr über Tische, so wie Würfel Bra, Kolleg, ich bin am fliegen Geb' Kickdown, 300, alle andren bleiben liegen Sie sagen, Capital, den Erfolg musst du verdienen Doch ich darf nicht zum Splash  so wie Putin zum G7Also fick ich auf euch alle und geb' Kickdown für die Fam Für die Gang, für alle, die mich kenn'n Für jeden Hater und für jeden Fan Für alle Bratans, die mit Packets vor der Kripo renn'n Und jedes Mal, wenn mein Handy vibriert Bin ich umsatzfixiert, um-umsatzfixiert Oh Kolleg, es geht um buntes Papier Ich bin umsatzfixiert, um-umsatzfixiert Und immer noch suchen die Hunde bei mir Ich bin umsatzfixiert, um-umsatzfixiert Und du sagst, ich kann nicht rappen und bin untalentiert Doch ich bin umsatzfixiert, um-umsatzfixiert Ich tick' am Block mieses Gift, Stoff bis tip-top Kopf ist gefickt, weil der Cop mich fast kriegt Gerüche aus dem Kofferraum, Ott riecht so frisch Mach' mein Para haram, hoff', dass Gott mir vergibt Immer noch mit der Clique, G-G-Gold am Genick Immer noch hängt Deutschrap am Strick Kreuzberger Kings verpacken den Staub Kapsel und Kraut wird in Massen verkauft Dick a, nachts wird es laut, wir planen den Raub Alle drauf, Nase taub, Kugeln im Lauf Keine Skrupel, such es dir aus Blutige Faust, Wut sitzt im Bauch Zukunft ist Grau, Massari ist bunt Zwei-vier Karat ist der Schmuck und Haze in Luft Im Anzug von Chelsea wird Ware gepusht Banknoten, Geld fließt, Straße bringt plus Und jedes Mal, wenn mein Handy vibriert Bin ich umsatzfixiert, um-umsatzfixiert Oh Kolleg, es geht um buntes Papier Ich bin umsatzfixiert, um-umsatzfixiert Und immer noch suchen die Hunde bei mir Ich bin umsatzfixiert, um-umsatzfixiert Und du sagst, ich kann nicht rappen und bin untalentiert Doch ich bin umsatzfixiert, um-umsatzfixiert",186E5XovNHY19VgZPNjHJs,BLYAT,2017-09-29,5GA8GDo7RQC3JEanT81B3g,rap,gangster rap,de,"Umsatzfixiert-Capital Bra-Renn Wir sind Berliner, unsre Gegend ist ein bisschen krasser Schmeiß uns in 'ne Wüste und wir finden Wasser Wer von euch ist Baba? Ach, mach mal kein Palaver Ich fress' die Ratten auf wie 'ne Mamba Bratan, ja, Kolleg, ich sorg' für Wirbel Der Bratan will die Bündel, Makarow im Guccigürtel Erzähl mir nix von dir und deinem krassen Viertel Komm'n wir in dein Cafe, dann fliegt ihr über Tische, so wie Würfel Bra, Kolleg, ich bin am fliegen Geb' Kickdown, 300, alle andren bleiben liegen Sie sagen, Capital, den Erfolg musst du verdienen Doch ich darf nicht zum Splash  so wie Putin zum G7Also fick ich auf euch alle und geb' Kickdown für die Fam Für die Gang, für alle, die mich kenn'n Für jeden Hater und für jeden Fan Für alle Bratans, die mit Packets vor der Kripo renn'n Und jedes Mal, wenn mein Handy vibriert Bin ich umsatzfixiert, um-umsatzfixiert Oh Kolleg, es geht um buntes Papier Ich bin umsatzfixiert, um-umsatzfixiert Und immer noch suchen die Hunde bei mir Ich bin umsatzfixiert, um-umsatzfixiert Und du sagst, ich kann nicht rappen und bin untalentiert Doch ich bin umsatzfixiert, um-umsatzfixiert Ich tick' am Block mieses Gift, Stoff bis tip-top Kopf ist gefickt, weil der Cop mich fast kriegt Gerüche aus dem Kofferraum, Ott riecht so frisch Mach' mein Para haram, hoff', dass Gott mir vergibt Immer noch mit der Clique, G-G-Gold am Genick Immer noch hängt Deutschrap am Strick Kreuzberger Kings verpacken den Staub Kapsel und Kraut wird in Massen verkauft Dick a, nachts wird es laut, wir planen den Raub Alle drauf, Nase taub, Kugeln im Lauf Keine Skrupel, such es dir aus Blutige Faust, Wut sitzt im Bauch Zukunft ist Grau, Massari ist bunt Zwei-vier Karat ist der Schmuck und Haze in Luft Im Anzug von Chelsea wird Ware gepusht Banknoten, Geld fließt, Straße bringt plus Und jedes Mal, wenn mein Handy vibriert Bin ich umsatzfixiert, um-umsatzfixiert Oh Kolleg, es geht um buntes Papier Ich bin umsatzfixiert, um-umsatzfixiert Und immer noch suchen die Hunde bei mir Ich bin umsatzfixiert, um-umsatzfixiert Und du sagst, ich kann nicht rappen und bin untalentiert Doch ich bin umsatzfixiert, um-umsatzfixiert-rap-gangster rap"
141lghKsBrt4uofVcNBxmD,Koprolalie,Agonoize,"Fick mich Ja! Schrei mich an, das find ich schön Ich werd ganz geil von dem Gestöhn Sei pervers und sei obszön Wenn du vom Ficken sprichst, ist das so schön Koprolalie Du stöhnst, du kreischst Bis der Verstand der Erregung weicht Unkontrolliert wie im Wahn Ordinär, das macht mich so an Fick mich Schrei mich an, das find ich schön Ich werd ganz geil von dem Gestöhn Sei pervers und sei obszön Wenn du vom Ficken sprichst, ist das so schön Koprolalie - schrei mich an Koprolalie - sei obszön Koprolalie - sei pervers Koprolalie - schrei mich an Ich liebe es - das Dunkle in dir Dein Leid verwandelt mich zum Tier Lass es raus mit voller Kraft Bis meine Lende zum Leben erwacht Lass es raus, die Bestie in dir Ziere dich nicht und offenbare dich mir Es törnt mich an, darum weiß ich auch nicht Wer jetzt kranker ist - du oder ich Schrei mich an, das find ich schön Ich werd ganz geil von dem Gestöhn Sei pervers und sei obszön Wenn du vom Ficken sprichst, ist das so schön Koprolalie - schrei mich an Koprolalie - sei obszön Koprolalie - sei pervers Koprolalie - schrei mich an",2fIafLbozLd3uDiWe611Xy,Ultraviolent Six,2006-06-29,53CmFroG6MWR5reOOXJX6B,pop,electropop,de,"Koprolalie-Agonoize-Fick mich Ja! Schrei mich an, das find ich schön Ich werd ganz geil von dem Gestöhn Sei pervers und sei obszön Wenn du vom Ficken sprichst, ist das so schön Koprolalie Du stöhnst, du kreischst Bis der Verstand der Erregung weicht Unkontrolliert wie im Wahn Ordinär, das macht mich so an Fick mich Schrei mich an, das find ich schön Ich werd ganz geil von dem Gestöhn Sei pervers und sei obszön Wenn du vom Ficken sprichst, ist das so schön Koprolalie - schrei mich an Koprolalie - sei obszön Koprolalie - sei pervers Koprolalie - schrei mich an Ich liebe es - das Dunkle in dir Dein Leid verwandelt mich zum Tier Lass es raus mit voller Kraft Bis meine Lende zum Leben erwacht Lass es raus, die Bestie in dir Ziere dich nicht und offenbare dich mir Es törnt mich an, darum weiß ich auch nicht Wer jetzt kranker ist - du oder ich Schrei mich an, das find ich schön Ich werd ganz geil von dem Gestöhn Sei pervers und sei obszön Wenn du vom Ficken sprichst, ist das so schön Koprolalie - schrei mich an Koprolalie - sei obszön Koprolalie - sei pervers Koprolalie - schrei mich an-pop-electropop"
14TfQoQHxTjxVKfTxb5plI,Staatsfeind,Agonoize,"Ich frag mich schon seit geraumer Zeit Fehlt's diesem Land an Gerechtigkeit? Wo ist der Sinn? Wo ist die Struktur An diesem Übermaß an Zensur?! Staatsfeind!!! Bin ich pervers, nur weil ich auf andre Dinge steh? Und die Welt nicht mit deinen Augen seh? Das ganze Land versinkt in einer Lethargie Es bleibt kein Raum mehr für Ideologie Es ist der Frust einer Generation Die Zeit ist reif für die Revolution Hab keine Lust mehr nur noch stumm zu sein Denn manchmal möchte ich nur noch schreien! Es kotzt mich an, dass ich nicht leben kann, wo ich will Es kotzt mich an, dass ich nicht tragen kann, was ich will Es kotzt mich an, dass ich nicht sein kann, wie ich will Es kotzt mich an, dass ich nicht sagen kann, was ich will Es kotzt mich an ... Es kotzt mich an ... Staatsfeind! Ich bin ich ... Ich bin wie ich bin ... Ich bin ich ... Ich bin wie ich bin ... Hab keine Lust auf eine Welt In der nur noch mein Äußeres zählt Ich hab die Weichen längst gestellt Also leck mich, wenn's dir nicht gefällt! Hab keine Lust nur stramm zu stehn Um in der Masse unterzugehen Armes Land, arme Welt Also fick dich, wenn's dir nicht gefällt! Staatsfeind! Bin ich ein Staatsfeind? Vielleicht schwimme ich gegen den Strom Doch auch ich bin Teil dieser Nation Der Staat diktiert, inspiziert und kontrolliert Während ihr euch abgestumpft reproduziert Ich hab es satt dumm rum zu lügen Um mich dem Schema F zu fügen Wenn es nicht anders geht, dann hass mich, hass mich! Wenn du mich ändern willst, fick dich, leck mich! Hab keine Lust auf eine Welt In der nur noch mein Äußeres zählt Ich hab die Weichen längst gestellt Also leck mich, wenn's dir nicht gefällt! Hab keine Lust nur stramm zu stehn Um in der Masse unterzugehen Armes Land, arme Welt Also fick dich, wenn's dir nicht gefällt! Staatsfeind! Bin ich ein Staatsfeind?",1fqgQQUy2LAFe90sF2VktM,For The Sick And Disturbed,2008-10-31,53CmFroG6MWR5reOOXJX6B,pop,electropop,de,"Staatsfeind-Agonoize-Ich frag mich schon seit geraumer Zeit Fehlt's diesem Land an Gerechtigkeit? Wo ist der Sinn? Wo ist die Struktur An diesem Übermaß an Zensur?! Staatsfeind!!! Bin ich pervers, nur weil ich auf andre Dinge steh? Und die Welt nicht mit deinen Augen seh? Das ganze Land versinkt in einer Lethargie Es bleibt kein Raum mehr für Ideologie Es ist der Frust einer Generation Die Zeit ist reif für die Revolution Hab keine Lust mehr nur noch stumm zu sein Denn manchmal möchte ich nur noch schreien! Es kotzt mich an, dass ich nicht leben kann, wo ich will Es kotzt mich an, dass ich nicht tragen kann, was ich will Es kotzt mich an, dass ich nicht sein kann, wie ich will Es kotzt mich an, dass ich nicht sagen kann, was ich will Es kotzt mich an ... Es kotzt mich an ... Staatsfeind! Ich bin ich ... Ich bin wie ich bin ... Ich bin ich ... Ich bin wie ich bin ... Hab keine Lust auf eine Welt In der nur noch mein Äußeres zählt Ich hab die Weichen längst gestellt Also leck mich, wenn's dir nicht gefällt! Hab keine Lust nur stramm zu stehn Um in der Masse unterzugehen Armes Land, arme Welt Also fick dich, wenn's dir nicht gefällt! Staatsfeind! Bin ich ein Staatsfeind? Vielleicht schwimme ich gegen den Strom Doch auch ich bin Teil dieser Nation Der Staat diktiert, inspiziert und kontrolliert Während ihr euch abgestumpft reproduziert Ich hab es satt dumm rum zu lügen Um mich dem Schema F zu fügen Wenn es nicht anders geht, dann hass mich, hass mich! Wenn du mich ändern willst, fick dich, leck mich! Hab keine Lust auf eine Welt In der nur noch mein Äußeres zählt Ich hab die Weichen längst gestellt Also leck mich, wenn's dir nicht gefällt! Hab keine Lust nur stramm zu stehn Um in der Masse unterzugehen Armes Land, arme Welt Also fick dich, wenn's dir nicht gefällt! Staatsfeind! Bin ich ein Staatsfeind?-pop-electropop"
15puTooEPaB3CTeFsNCqst,Meister Yoda,Azet,"Yeah, oh Selam, selam, selam, selam, choya Ghetto-Gs in 'nem Benz, selam ya choya Ich sitz' im VIP-Bereich und trinke Soda Meine Gang ist fresh, fresh wie 'ne Cola Mein Cash ist grün, mein Dope ist grün wie Meister Yoda Ghetto-Gs in 'nem Benz, selam ya choya Ich sitz' im VIP-Bereich und trinke Soda Meine Gang ist fresh, fresh wie 'ne Cola Mein Cash ist grün, mein Dope ist grün wie Meister Yoda Selam, selam, choya Pack' die Packs in den AMG Ich leb' und sterb' als Dealer Schnelles Geld, schnelles Leben Schnell gelernt, wie das Business läuft Ein Dealer zieht niemals sein Zeug Ihr Geld kommt und Geld geht Aber wenn Geld geht, dann mach ich neues – easy! Kalashnikowa, Azet ballert Kush Pack' die Packs ab, choya, für Bares, Para, Flous Hände weg von mei'm Benz, du denkst, du fährst so ein'n selber Doch in mein steckt noch Kokain im Wert von drei Benzer Ándale, ándale, fast life, geb' Kickdown Mach' mit den Jungs mein Geld in der Hood, geb's aus in der VIP-Lounge Alles nur für die Euros, reich werden durch Koka (Kokain) Alles nur für die Rolex, Rolex Daytona Rolex Daytona, Kokaina, zähle Lila Koks oder Gras oder Mele7, Dealer-Gs im Lamborghini KMN Dresdencity, du willst Stress mit Sile7 Doch mein Bruder sagt nur: „Kill ihn!“, choya Ghetto-Gs in 'nem Benz, selam ya choya Ich sitz' im VIP-Bereich und trinke Soda Meine Gang ist fresh, fresh wie 'ne Cola Mein Cash ist grün, mein Dope ist grün wie Meister Yoda Ghetto-Gs in 'nem Benz, selam ya choya Ich sitz' im VIP-Bereich und trinke Soda Meine Gang ist fresh, fresh wie 'ne Cola Mein Cash ist grün, mein Dope ist grün wie Meister Yoda Selam, selam, choya, Dresdencity wohnhaft, Dicka Hunger von Montag bis Montag, zwei Kilogramm Koka im Monat Fick LKA, weil sie mein'n Kragen woll'nDrück' Pakete weg, mach' die Niketasche voll Mit zweihundert brettern vorbei am Polizeizoll Im Kofferraum Weißes und Poll'n Alles dreht sich um Euros, es geht um Batzen, bunker' bei Mama Importware aus Neuhof, wenn du nichts zahlst, ballert Mustafa, à la Zwei Tage Cannabispakete, yallah, na3na3, trinken mit Ammar Lagerwechsel, Kokain vom Albaner, aber haram, wallah Haben Kontakte zu Männern, die den Markt kontrollier'n, vernetzt in Europa Stapel' lila Papier reicht für zehn AMGs, aber lenken Toyota Jap, willkomm'n im Milleu, neine Art Neunmillimeter Jap, willkomm'n im Milleu, essen helal, leben illegal Schieben Filme, für sieben Mille gibt es Menschen, die killen Drücken ab, kommen von hinten, in den Rücken Für Geld, denn die Hemmschwellen sinken Vollzeitbandit auf Adrenalin Tonnen verdien'n und Amphetamin Ghetto-Gs in 'nem Benz, selam ya choya Ich sitz' im VIP-Bereich und trinke Soda Meine Gang ist fresh, fresh wie 'ne Cola Mein Cash ist grün, mein Dope ist grün wie Meister Yoda Ghetto-Gs in 'nem Benz, selam ya choya Ich sitz' im VIP-Bereich und trinke Soda Meine Gang ist fresh, fresh wie 'ne Cola Mein Cash ist grün, mein Dope ist grün wie Meister Yoda",59au6R9MrAnKMxeS49LUOu,Fast Life,2016-06-03,5GA8GDo7RQC3JEanT81B3g,rap,gangster rap,de,"Meister Yoda-Azet-Yeah, oh Selam, selam, selam, selam, choya Ghetto-Gs in 'nem Benz, selam ya choya Ich sitz' im VIP-Bereich und trinke Soda Meine Gang ist fresh, fresh wie 'ne Cola Mein Cash ist grün, mein Dope ist grün wie Meister Yoda Ghetto-Gs in 'nem Benz, selam ya choya Ich sitz' im VIP-Bereich und trinke Soda Meine Gang ist fresh, fresh wie 'ne Cola Mein Cash ist grün, mein Dope ist grün wie Meister Yoda Selam, selam, choya Pack' die Packs in den AMG Ich leb' und sterb' als Dealer Schnelles Geld, schnelles Leben Schnell gelernt, wie das Business läuft Ein Dealer zieht niemals sein Zeug Ihr Geld kommt und Geld geht Aber wenn Geld geht, dann mach ich neues – easy! Kalashnikowa, Azet ballert Kush Pack' die Packs ab, choya, für Bares, Para, Flous Hände weg von mei'm Benz, du denkst, du fährst so ein'n selber Doch in mein steckt noch Kokain im Wert von drei Benzer Ándale, ándale, fast life, geb' Kickdown Mach' mit den Jungs mein Geld in der Hood, geb's aus in der VIP-Lounge Alles nur für die Euros, reich werden durch Koka (Kokain) Alles nur für die Rolex, Rolex Daytona Rolex Daytona, Kokaina, zähle Lila Koks oder Gras oder Mele7, Dealer-Gs im Lamborghini KMN Dresdencity, du willst Stress mit Sile7 Doch mein Bruder sagt nur: „Kill ihn!“, choya Ghetto-Gs in 'nem Benz, selam ya choya Ich sitz' im VIP-Bereich und trinke Soda Meine Gang ist fresh, fresh wie 'ne Cola Mein Cash ist grün, mein Dope ist grün wie Meister Yoda Ghetto-Gs in 'nem Benz, selam ya choya Ich sitz' im VIP-Bereich und trinke Soda Meine Gang ist fresh, fresh wie 'ne Cola Mein Cash ist grün, mein Dope ist grün wie Meister Yoda Selam, selam, choya, Dresdencity wohnhaft, Dicka Hunger von Montag bis Montag, zwei Kilogramm Koka im Monat Fick LKA, weil sie mein'n Kragen woll'nDrück' Pakete weg, mach' die Niketasche voll Mit zweihundert brettern vorbei am Polizeizoll Im Kofferraum Weißes und Poll'n Alles dreht sich um Euros, es geht um Batzen, bunker' bei Mama Importware aus Neuhof, wenn du nichts zahlst, ballert Mustafa, à la Zwei Tage Cannabispakete, yallah, na3na3, trinken mit Ammar Lagerwechsel, Kokain vom Albaner, aber haram, wallah Haben Kontakte zu Männern, die den Markt kontrollier'n, vernetzt in Europa Stapel' lila Papier reicht für zehn AMGs, aber lenken Toyota Jap, willkomm'n im Milleu, neine Art Neunmillimeter Jap, willkomm'n im Milleu, essen helal, leben illegal Schieben Filme, für sieben Mille gibt es Menschen, die killen Drücken ab, kommen von hinten, in den Rücken Für Geld, denn die Hemmschwellen sinken Vollzeitbandit auf Adrenalin Tonnen verdien'n und Amphetamin Ghetto-Gs in 'nem Benz, selam ya choya Ich sitz' im VIP-Bereich und trinke Soda Meine Gang ist fresh, fresh wie 'ne Cola Mein Cash ist grün, mein Dope ist grün wie Meister Yoda Ghetto-Gs in 'nem Benz, selam ya choya Ich sitz' im VIP-Bereich und trinke Soda Meine Gang ist fresh, fresh wie 'ne Cola Mein Cash ist grün, mein Dope ist grün wie Meister Yoda-rap-gangster rap"
17dHqzRsRD7jA6JReeGsX8,Kanax in Moskau,KC Rebell,"Gangsterflow, Al Tawon, maricon, das ist Gossensound Du bist kein Hase, doch ich zieh dich mit Karotten auf Dann sagt deine Fotze ""Wow, was ein Mords-Ding""Denn ich benutz ein' Hula-Hoop Reifen als Cockring Du willst mich verarschen, ich lass dich durch die Gun sterben Denn man kann mich nur per Bodypainting anschwärzen Ich bin ein Playboy, ficke eure Mütter gut Frauen drehen mir nur beim Arschfick den Rücken zu Deine Mutter will mein' Cock gleich haben Doch ich halt nichts von der Bitch außer den Kopf beim blasen Und am Hochzeitsabend geb ich an Mösen schwanz Welche Nutte sagt, es kommt nicht auf die Schwanzgröße an? Wenn ich grade nicht Shisha rauch Dann siehst du mein Glied im Maul einer Spielerfrau Mütter werden gefickt am 30. Mai Banger Musik, KC Rebell, nach der zwei kommt die eins Ich zähle kein Geld, weil ich nicht so viel Zeit hab Du wahrscheinlich auch nicht, ich glaube weil du keins hast Banger Musik, die Scheiße geht weiter Farid, KC, unser Modus ist Hayvan Kanax in Moskau, ich boxe den Türsteher weg Du willst in die Juice, ich will in die Hürriyet Kanax in Moskau, ich mach Tanja klar Dein Mund sagt zwar nein aber mein Schwanz sagt ja Kanax in Moskau, sie möchten kein Guntalk Und Ferris sieht aus wie der Glöckner von Hamburg Kanax in Moskau, ich lass Kate Moss kauen Und rede nicht von Shisha wenn ich Kohle auf den Kopf hau Deutschland will Gesetze über Scheiden einführen Ich will mein' Schwanz in Scheiden einführen Verriegel Scheiben und Türen, denn wenn der Rebell dich erschlägt Wurdest du wie die 12 Apostel zum letzten Mal gesehen Das ist Gangster-Rap im Unterhemd, ich bin der, der deine Mutter bangt Ich fick den Bachelor im Dschungelcamp Und du bist bei den Bullen ein Zinker Denn du willst verpfeifen wie ein guter Schiedsrichter Dreh den Sound laut, Reb-Rebell Bosssound Gangbang mit Top Frauen, Kanax in Moskau Im Vollrausch, der King macht Ärger Du hast an deinen Lippen Sperma wie Hitzlsperger Komm ich zeig dir, dass Rap nicht mehr als Disses ist Zeige dir, wie verhurt deine Misses ist Beef mit mir wiss-sess-sess, das ist wie'n Zebrastreifen Die anderen gehen wenn ich stehen bleibe Ich zähle kein Geld, weil ich nicht so viel Zeit hab Du wahrscheinlich auch nicht, ich glaube weil du keins hast Banger Musik, die Scheiße geht weiter Farid, KC, unser Modus ist Hayvan Kanax in Moskau, ich boxe den Türsteher weg Du willst in die Juice, ich will in die Hürriyet Kanax in Moskau, ich mach Tanja klar Dein Mund sagt zwar nein aber mein Schwanz sagt ja Kanax in Moskau, sie möchten kein Guntalk Und Ferris sieht aus wie der Glöckner von Hamburg Kanax in Moskau, ich lass Kate Moss kauen Und rede nicht von Shisha wenn ich Kohle auf den Kopf hau Werd Teil der RGD-Community!",5HZ1TttTycgWe0UkbA5TJQ,Rebellution (Deluxe Version),2014-05-30,1qXg9ck25tBRxeXsj8mbDG,rap,gangster rap,de,"Kanax in Moskau-KC Rebell-Gangsterflow, Al Tawon, maricon, das ist Gossensound Du bist kein Hase, doch ich zieh dich mit Karotten auf Dann sagt deine Fotze ""Wow, was ein Mords-Ding""Denn ich benutz ein' Hula-Hoop Reifen als Cockring Du willst mich verarschen, ich lass dich durch die Gun sterben Denn man kann mich nur per Bodypainting anschwärzen Ich bin ein Playboy, ficke eure Mütter gut Frauen drehen mir nur beim Arschfick den Rücken zu Deine Mutter will mein' Cock gleich haben Doch ich halt nichts von der Bitch außer den Kopf beim blasen Und am Hochzeitsabend geb ich an Mösen schwanz Welche Nutte sagt, es kommt nicht auf die Schwanzgröße an? Wenn ich grade nicht Shisha rauch Dann siehst du mein Glied im Maul einer Spielerfrau Mütter werden gefickt am 30. Mai Banger Musik, KC Rebell, nach der zwei kommt die eins Ich zähle kein Geld, weil ich nicht so viel Zeit hab Du wahrscheinlich auch nicht, ich glaube weil du keins hast Banger Musik, die Scheiße geht weiter Farid, KC, unser Modus ist Hayvan Kanax in Moskau, ich boxe den Türsteher weg Du willst in die Juice, ich will in die Hürriyet Kanax in Moskau, ich mach Tanja klar Dein Mund sagt zwar nein aber mein Schwanz sagt ja Kanax in Moskau, sie möchten kein Guntalk Und Ferris sieht aus wie der Glöckner von Hamburg Kanax in Moskau, ich lass Kate Moss kauen Und rede nicht von Shisha wenn ich Kohle auf den Kopf hau Deutschland will Gesetze über Scheiden einführen Ich will mein' Schwanz in Scheiden einführen Verriegel Scheiben und Türen, denn wenn der Rebell dich erschlägt Wurdest du wie die 12 Apostel zum letzten Mal gesehen Das ist Gangster-Rap im Unterhemd, ich bin der, der deine Mutter bangt Ich fick den Bachelor im Dschungelcamp Und du bist bei den Bullen ein Zinker Denn du willst verpfeifen wie ein guter Schiedsrichter Dreh den Sound laut, Reb-Rebell Bosssound Gangbang mit Top Frauen, Kanax in Moskau Im Vollrausch, der King macht Ärger Du hast an deinen Lippen Sperma wie Hitzlsperger Komm ich zeig dir, dass Rap nicht mehr als Disses ist Zeige dir, wie verhurt deine Misses ist Beef mit mir wiss-sess-sess, das ist wie'n Zebrastreifen Die anderen gehen wenn ich stehen bleibe Ich zähle kein Geld, weil ich nicht so viel Zeit hab Du wahrscheinlich auch nicht, ich glaube weil du keins hast Banger Musik, die Scheiße geht weiter Farid, KC, unser Modus ist Hayvan Kanax in Moskau, ich boxe den Türsteher weg Du willst in die Juice, ich will in die Hürriyet Kanax in Moskau, ich mach Tanja klar Dein Mund sagt zwar nein aber mein Schwanz sagt ja Kanax in Moskau, sie möchten kein Guntalk Und Ferris sieht aus wie der Glöckner von Hamburg Kanax in Moskau, ich lass Kate Moss kauen Und rede nicht von Shisha wenn ich Kohle auf den Kopf hau Werd Teil der RGD-Community!-rap-gangster rap"
